{
  "1-180": {
    "oparl_id": "1-180",
    "filename": "2007/2007-02-15_Bekanntmachung_(Fachausschuss_Planung,_Bau,_Umwelt,_Feuerschutz)_1-180.pdf",
    "access_url": "https://nordstemmen.ratsinfomanagement.net/webservice/oparl/v1.1/body/1/files/UGhVM0hpd2NXNFdFcExjZSQcio9nBpxEek34j-8rZCeYmBl3lluo2W_vqBmYpEsy/Bekanntmachung_Fachausschuss_Planung-_Bau-_Umwelt-_Feuerschutz_15.02.2007.pdf",
    "mime_type": "application/pdf",
    "name": "Bekanntmachung (Fachausschuss Planung, Bau, Umwelt, Feuerschutz)",
    "date": "2007-02-15",
    "downloaded_at": "2025-11-12T10:30:37.871Z"
  },
  "1-357": {
    "oparl_id": "1-357",
    "filename": "2007/2007-03-22_Beschlussvorlage_(Neufassung_der_Verordnung_zur_Aufrechterhaltung_der_öffentlichen_Sicherheit_und_Ordnung_in_der_Gemeinde_Nordstemmen,_Landkreis_Hildesheim)_1-357.pdf",
    "access_url": "https://nordstemmen.ratsinfomanagement.net/webservice/oparl/v1.1/body/1/files/UGhVM0hpd2NXNFdFcExjZaGFGOmNyIPxF_44O-PUStgMe8mx3WlTU-SHoVZ2UDdp/Beschlussvorlage_DS_2-2007_1._Ergaenzung.pdf",
    "mime_type": "application/pdf",
    "name": "Beschlussvorlage (Neufassung der Verordnung zur Aufrechterhaltung der öffentlichen Sicherheit und Ordnung in der Gemeinde Nordstemmen, Landkreis Hildesheim)",
    "date": "2007-03-22",
    "downloaded_at": "2025-11-12T10:30:38.020Z"
  },
  "1-232": {
    "oparl_id": "1-232",
    "filename": "2007/2007-03-05_Beschlussvorlage_(Anhörung_des_Ortsrates_zum_Haushaltsplan_2007_und_zum_Investitionsprogramm_für_den_Investitionszeitraum_bis_zum_Haushaltsjahr_2010_unter_Fortschreibung_des_Haushaltssi.pdf",
    "access_url": "https://nordstemmen.ratsinfomanagement.net/webservice/oparl/v1.1/body/1/files/UGhVM0hpd2NXNFdFcExjZRzJarkSRWTRbyRha-JJkpt5y4ukDw4xoAGS3OVAL1Tc/Beschlussvorlage_DS_12-2007.pdf",
    "mime_type": "application/pdf",
    "name": "Beschlussvorlage (Anhörung des Ortsrates zum Haushaltsplan 2007 und zum Investitionsprogramm für den Investitionszeitraum bis zum Haushaltsjahr 2010 unter Fortschreibung des Haushaltssicherungskonzeptes)",
    "date": "2007-03-05",
    "downloaded_at": "2025-11-12T10:30:38.021Z"
  },
  "1-898": {
    "oparl_id": "1-898",
    "filename": "2007/2007-06-06_Bekanntmachung_(Fachausschuss_Finanzen,_Wirtschaftsförderung_und_Marketing)_1-898.pdf",
    "access_url": "https://nordstemmen.ratsinfomanagement.net/webservice/oparl/v1.1/body/1/files/UGhVM0hpd2NXNFdFcExjZcLyPTl11hYizMH6YvRHOsuuqilT1I708-2IQ0ma3_6f/Bekanntmachung_Fachausschuss_Finanzen-_Wirtschaftsfoerderung_und_Marketing_06.06.2007.pdf",
    "mime_type": "application/pdf",
    "name": "Bekanntmachung (Fachausschuss Finanzen, Wirtschaftsförderung und Marketing)",
    "date": "2007-06-06",
    "downloaded_at": "2025-11-12T10:30:38.024Z"
  },
  "1-224": {
    "oparl_id": "1-224",
    "filename": "2007/2007-03-01_Beschlussvorlage_(Anhörung_des_Ortsrates_zum_Haushaltsplan_2007_und_zum_Investitionsprogramm_für_den_Investitionszeitraum_bis_zum_Haushaltsjahr_2010_unter_Fortschreibung_des_Haushaltssi.pdf",
    "access_url": "https://nordstemmen.ratsinfomanagement.net/webservice/oparl/v1.1/body/1/files/UGhVM0hpd2NXNFdFcExjZfTDu6qtgY9RROuunuved2j8A_NKYc76o4DQQiTHoMWQ/Beschlussvorlage_DS_10-2007.pdf",
    "mime_type": "application/pdf",
    "name": "Beschlussvorlage (Anhörung des Ortsrates zum Haushaltsplan 2007 und zum Investitionsprogramm für den Investitionszeitraum bis zum Haushaltsjahr 2010 unter Fortschreibung des Haushaltssicherungskonzeptes)",
    "date": "2007-03-01",
    "downloaded_at": "2025-11-12T10:30:38.037Z"
  },
  "1-256": {
    "oparl_id": "1-256",
    "filename": "2007/2007-03-06_Bekanntmachung_(Ortsrat_Barnten)_1-256.pdf",
    "access_url": "https://nordstemmen.ratsinfomanagement.net/webservice/oparl/v1.1/body/1/files/UGhVM0hpd2NXNFdFcExjZRonlGLds2NjYStdSOnMWDARhb7gBuQXCbuifbvR5WNZ/Bekanntmachung_Ortsrat_Barnten_06.03.2007.pdf",
    "mime_type": "application/pdf",
    "name": "Bekanntmachung (Ortsrat Barnten)",
    "date": "2007-03-06",
    "downloaded_at": "2025-11-12T10:30:38.038Z"
  },
  "1-492": {
    "oparl_id": "1-492",
    "filename": "2007/2007-03-22_Beschlussvorlage_(Bebauungsplan_Nr._0122__Innerörtliche_Verbindungsstraße___Zuckerfabrik_,_4._Änderung,_Ortschaft_Nordstemmen;_Satzungsbeschluss_gem._§_10_Abs._1_BauGB)_1-492.pdf",
    "access_url": "https://nordstemmen.ratsinfomanagement.net/webservice/oparl/v1.1/body/1/files/UGhVM0hpd2NXNFdFcExjZYLSrcv5bPN9HZsNr7uUNQS6IiSUeRU1JEHLTPdZKVu-/Beschlussvorlage_DS_37-2006_1._Ergaenzung.pdf",
    "mime_type": "application/pdf",
    "name": "Beschlussvorlage (Bebauungsplan Nr. 0122 \"Innerörtliche Verbindungsstraße / Zuckerfabrik\", 4. Änderung, Ortschaft Nordstemmen;\nSatzungsbeschluss gem. § 10 Abs. 1 BauGB)",
    "date": "2007-03-22",
    "downloaded_at": "2025-11-12T10:30:38.074Z"
  },
  "1-315": {
    "oparl_id": "1-315",
    "filename": "2007/2007-03-14_Bekanntmachung_(Fachausschuss_Finanzen,_Wirtschaftsförderung_und_Marketing)_1-315.pdf",
    "access_url": "https://nordstemmen.ratsinfomanagement.net/webservice/oparl/v1.1/body/1/files/UGhVM0hpd2NXNFdFcExjZRkpmP7WcF10sh4aOYSCsr5g8N32hPWqIQR-jcoE6Yio/Bekanntmachung_Fachausschuss_Finanzen-_Wirtschaftsfoerderung_und_Marketing_14.03.2007.pdf",
    "mime_type": "application/pdf",
    "name": "Bekanntmachung (Fachausschuss Finanzen, Wirtschaftsförderung und Marketing)",
    "date": "2007-03-14",
    "downloaded_at": "2025-11-12T10:30:38.077Z"
  },
  "1-1049": {
    "oparl_id": "1-1049",
    "filename": "2007/2007-06-18_Bekanntmachung_(Ortsrat_Adensen)_1-1049.pdf",
    "access_url": "https://nordstemmen.ratsinfomanagement.net/webservice/oparl/v1.1/body/1/files/UGhVM0hpd2NXNFdFcExjZUfA290gxUEJe2Xi4evIwJFoGOseWOQDGeThgbs3QoOU/Bekanntmachung_Ortsrat_Adensen_18.06.2007.pdf",
    "mime_type": "application/pdf",
    "name": "Bekanntmachung (Ortsrat Adensen)",
    "date": "2007-06-18",
    "downloaded_at": "2025-11-12T10:30:38.083Z"
  },
  "1-263": {
    "oparl_id": "1-263",
    "filename": "2007/2007-03-06_Bekanntmachung_(Ortsrat_Nordstemmen)_1-263.pdf",
    "access_url": "https://nordstemmen.ratsinfomanagement.net/webservice/oparl/v1.1/body/1/files/UGhVM0hpd2NXNFdFcExjZYS-xxk9QWAD99K_4mSDHlC3WzUnCNhAizU0PiZh0ygO/Bekanntmachung_Ortsrat_Nordstemmen_06.03.2007.pdf",
    "mime_type": "application/pdf",
    "name": "Bekanntmachung (Ortsrat Nordstemmen)",
    "date": "2007-03-06",
    "downloaded_at": "2025-11-12T10:30:38.149Z"
  },
  "1-272": {
    "oparl_id": "1-272",
    "filename": "2007/2007-03-08_Bekanntmachung_(Ortsrat_Mahlerten)_1-272.pdf",
    "access_url": "https://nordstemmen.ratsinfomanagement.net/webservice/oparl/v1.1/body/1/files/UGhVM0hpd2NXNFdFcExjZSZMbU3t1287tm1H1tfK8oXuKL0xeEA7pjYIYYGvFoeg/Bekanntmachung_Ortsrat_Mahlerten_08.03.2007.pdf",
    "mime_type": "application/pdf",
    "name": "Bekanntmachung (Ortsrat Mahlerten)",
    "date": "2007-03-08",
    "downloaded_at": "2025-11-12T10:30:38.183Z"
  },
  "1-1105": {
    "oparl_id": "1-1105",
    "filename": "2007/2007-06-26_Bekanntmachung_(Fachausschuss_Freizeit,_Kultur,_Jugend,_Soziales,_Demographie)_1-1105.pdf",
    "access_url": "https://nordstemmen.ratsinfomanagement.net/webservice/oparl/v1.1/body/1/files/UGhVM0hpd2NXNFdFcExjZamZ-wt4jGR6SDA5lflrRLdAI7mPRGCOj0Qdlx559SV7/Bekanntmachung_Fachausschuss_Freizeit-_Kultur-_Jugend-_Soziales-_Demographie_26.06.2007.pdf",
    "mime_type": "application/pdf",
    "name": "Bekanntmachung (Fachausschuss Freizeit, Kultur, Jugend, Soziales, Demographie)",
    "date": "2007-06-26",
    "downloaded_at": "2025-11-12T10:30:38.290Z"
  },
  "1-254": {
    "oparl_id": "1-254",
    "filename": "2007/2007-03-06_Bekanntmachung_(Ortsrat_Rössing)_1-254.pdf",
    "access_url": "https://nordstemmen.ratsinfomanagement.net/webservice/oparl/v1.1/body/1/files/UGhVM0hpd2NXNFdFcExjZc73j5x76SVUivpVoYZnyoJvZNH_HdXSDl8Th4qyg4pL/Bekanntmachung_Ortsrat_Roessing_06.03.2007.pdf",
    "mime_type": "application/pdf",
    "name": "Bekanntmachung (Ortsrat Rössing)",
    "date": "2007-03-06",
    "downloaded_at": "2025-11-12T10:30:38.410Z"
  },
  "1-242": {
    "oparl_id": "1-242",
    "filename": "2007/2007-03-01_Bekanntmachung_(Ortsrat_Klein_Escherde)_1-242.pdf",
    "access_url": "https://nordstemmen.ratsinfomanagement.net/webservice/oparl/v1.1/body/1/files/UGhVM0hpd2NXNFdFcExjZUwdDmFnbE_ElhtosS1lkNqJzkpNqwnp4CoFarmdswAo/Bekanntmachung_Ortsrat_Klein_Escherde_01.03.2007.pdf",
    "mime_type": "application/pdf",
    "name": "Bekanntmachung (Ortsrat Klein Escherde)",
    "date": "2007-03-01",
    "downloaded_at": "2025-11-12T10:30:38.411Z"
  },
  "1-535": {
    "oparl_id": "1-535",
    "filename": "2007/2007-05-03_Bekanntmachung_(Ortsrat_Nordstemmen)_1-535.pdf",
    "access_url": "https://nordstemmen.ratsinfomanagement.net/webservice/oparl/v1.1/body/1/files/UGhVM0hpd2NXNFdFcExjZWPTSfPg89R80-tL-8w8kQ2yBtia3bnVBF8_QJR_d9yB/Bekanntmachung_Ortsrat_Nordstemmen_03.05.2007.pdf",
    "mime_type": "application/pdf",
    "name": "Bekanntmachung (Ortsrat Nordstemmen)",
    "date": "2007-05-03",
    "downloaded_at": "2025-11-12T10:30:38.412Z"
  },
  "1-231": {
    "oparl_id": "1-231",
    "filename": "2007/2007-02-28_Bekanntmachung_(Ortsrat_Heyersum)_1-231.pdf",
    "access_url": "https://nordstemmen.ratsinfomanagement.net/webservice/oparl/v1.1/body/1/files/UGhVM0hpd2NXNFdFcExjZWK0Dw6UKGRoKpcWAwS1ucIIimHIjbLQXCnXlczIIvkb/Bekanntmachung_Ortsrat_Heyersum_28.02.2007.pdf",
    "mime_type": "application/pdf",
    "name": "Bekanntmachung (Ortsrat Heyersum)",
    "date": "2007-02-28",
    "downloaded_at": "2025-11-12T10:30:38.413Z"
  },
  "1-904": {
    "oparl_id": "1-904",
    "filename": "2007/2007-06-14_Bekanntmachung_(Rat)_1-904.pdf",
    "access_url": "https://nordstemmen.ratsinfomanagement.net/webservice/oparl/v1.1/body/1/files/UGhVM0hpd2NXNFdFcExjZTbstA6BjJRS_VHG5z5uy0EdsYxGx8w6msiLM4nAioX2/Bekanntmachung_Rat_14.06.2007.pdf",
    "mime_type": "application/pdf",
    "name": "Bekanntmachung (Rat)",
    "date": "2007-06-14",
    "downloaded_at": "2025-11-12T10:30:38.416Z"
  },
  "1-1047": {
    "oparl_id": "1-1047",
    "filename": "2007/2007-06-19_Bekanntmachung_(Ortsrat_Barnten)_1-1047.pdf",
    "access_url": "https://nordstemmen.ratsinfomanagement.net/webservice/oparl/v1.1/body/1/files/UGhVM0hpd2NXNFdFcExjZUKAf27IXOz1a-9S-xtadNcEz0Fg8QuUl8Nnx15lGoT9/Bekanntmachung_Ortsrat_Barnten_19.06.2007.pdf",
    "mime_type": "application/pdf",
    "name": "Bekanntmachung (Ortsrat Barnten)",
    "date": "2007-06-19",
    "downloaded_at": "2025-11-12T10:30:38.438Z"
  },
  "1-238": {
    "oparl_id": "1-238",
    "filename": "2007/2007-03-06_Beschlussvorlage_(Anhörung_des_Ortsrates_zum_Haushaltsplan_2007_und_zum_Investitionsprogramm_für_den_Investitionszeitraum_bis_zum_Haushaltsjahr_2010_unter_Fortschreibung_des_Haushaltssi.pdf",
    "access_url": "https://nordstemmen.ratsinfomanagement.net/webservice/oparl/v1.1/body/1/files/UGhVM0hpd2NXNFdFcExjZYOuWb9jzXAUxdHKGV2nU7xOw_LtnAXW6TPRn9V8_QmB/Beschlussvorlage_DS_14-2007.pdf",
    "mime_type": "application/pdf",
    "name": "Beschlussvorlage (Anhörung des Ortsrates zum Haushaltsplan 2007 und zum Investitionsprogramm für den Investitionszeitraum bis zum Haushaltsjahr 2010 unter Fortschreibung des Haushaltssicherungskonzeptes)",
    "date": "2007-03-06",
    "downloaded_at": "2025-11-12T10:30:38.449Z"
  },
  "1-1077": {
    "oparl_id": "1-1077",
    "filename": "2007/2007-06-25_Bekanntmachung_(Ortsrat_Groß_Escherde)_1-1077.pdf",
    "access_url": "https://nordstemmen.ratsinfomanagement.net/webservice/oparl/v1.1/body/1/files/UGhVM0hpd2NXNFdFcExjZRmBdZrNjSlFAiCZ__vHnccHtY_rtGrOgK9__lq_PXeG/Bekanntmachung_Ortsrat_Gross_Escherde_25.06.2007.pdf",
    "mime_type": "application/pdf",
    "name": "Bekanntmachung (Ortsrat Groß Escherde)",
    "date": "2007-06-25",
    "downloaded_at": "2025-11-12T10:30:38.464Z"
  },
  "1-540": {
    "oparl_id": "1-540",
    "filename": "2007/2007-05-03_Bekanntmachung_(Rat)_1-540.pdf",
    "access_url": "https://nordstemmen.ratsinfomanagement.net/webservice/oparl/v1.1/body/1/files/UGhVM0hpd2NXNFdFcExjZTwJSuYYPo1LchW8dKgd1phXqhpx7Fh9gvnYMKkQ22k6/Bekanntmachung_Rat_03.05.2007.pdf",
    "mime_type": "application/pdf",
    "name": "Bekanntmachung (Rat)",
    "date": "2007-05-03",
    "downloaded_at": "2025-11-12T10:30:38.520Z"
  },
  "1-1106": {
    "oparl_id": "1-1106",
    "filename": "2007/2007-07-12_Beschlussvorlage_(Bebauungsplan_Nr._0120__Hauptstraße_-_Mitte_III_,_1._Änderung,_Ortschaft_Nordstemmen;_Satzungsbeschluss_gemäß_§_10_Abs._1_BauGB)_1-1106.pdf",
    "access_url": "https://nordstemmen.ratsinfomanagement.net/webservice/oparl/v1.1/body/1/files/UGhVM0hpd2NXNFdFcExjZTPT1YT9FZpl3WI5TK6Yvbv1VSaH8FPxfmnmc9OqpVnZ/Beschlussvorlage_DS_50-2007.pdf",
    "mime_type": "application/pdf",
    "name": "Beschlussvorlage (Bebauungsplan Nr. 0120 \"Hauptstraße - Mitte III\", 1. Änderung, Ortschaft Nordstemmen;\n\nSatzungsbeschluss gemäß § 10 Abs. 1 BauGB)",
    "date": "2007-07-12",
    "downloaded_at": "2025-11-12T10:30:38.559Z"
  },
  "1-448": {
    "oparl_id": "1-448",
    "filename": "2007/2007-04-03_Bekanntmachung_(Fachausschuss_Planung,_Bau,_Umwelt,_Feuerschutz)_1-448.pdf",
    "access_url": "https://nordstemmen.ratsinfomanagement.net/webservice/oparl/v1.1/body/1/files/UGhVM0hpd2NXNFdFcExjZRih0qFl5VZiK9Ec4KrbiY_zONp1BBhkY0by4b5ySEop/Bekanntmachung_Fachausschuss_Planung-_Bau-_Umwelt-_Feuerschutz_03.04.2007.pdf",
    "mime_type": "application/pdf",
    "name": "Bekanntmachung (Fachausschuss Planung, Bau, Umwelt, Feuerschutz)",
    "date": "2007-04-03",
    "downloaded_at": "2025-11-12T10:30:38.634Z"
  },
  "1-277": {
    "oparl_id": "1-277",
    "filename": "2007/2007-03-22_Beschlussvorlage_(Freizeitbad_Nordstemmen___Badesaison_2007)_1-277.pdf",
    "access_url": "https://nordstemmen.ratsinfomanagement.net/webservice/oparl/v1.1/body/1/files/UGhVM0hpd2NXNFdFcExjZYxZufxN-A7nPCCL1L42YiTqst9aQzZSPK0ebxaO2NeZ/Beschlussvorlage_DS_6-2007.pdf",
    "mime_type": "application/pdf",
    "name": "Beschlussvorlage (Freizeitbad Nordstemmen / Badesaison 2007)",
    "date": "2007-03-22",
    "downloaded_at": "2025-11-12T10:30:38.735Z"
  },
  "1-227": {
    "oparl_id": "1-227",
    "filename": "2007/2007-03-05_Beschlussvorlage_(Anhörung_des_Ortsrates_zum_Haushaltsplan_2007_und_zum_Investitionsprogramm_für_den_Investitionszeitraum_bis_zum_Haushaltsjahr_2010_unter_Fortschreibung_des_Haushaltssi.pdf",
    "access_url": "https://nordstemmen.ratsinfomanagement.net/webservice/oparl/v1.1/body/1/files/UGhVM0hpd2NXNFdFcExjZRrFq2G9EqP-Ua1qok1L7Jy8UP_3LMDo40oU-ZDyxl1q/Beschlussvorlage_DS_11-2007.pdf",
    "mime_type": "application/pdf",
    "name": "Beschlussvorlage (Anhörung des Ortsrates zum Haushaltsplan 2007 und zum Investitionsprogramm für den Investitionszeitraum bis zum Haushaltsjahr 2010 unter Fortschreibung des Haushaltssicherungskonzeptes)",
    "date": "2007-03-05",
    "downloaded_at": "2025-11-12T10:30:38.787Z"
  },
  "1-1324": {
    "oparl_id": "1-1324",
    "filename": "2007/2007-07-12_Beschlussvorlage_(Bebauungsplan_Nr._0125__Mahlerter_Straße_-_Nord_2._Änderung;_Satzungsbeschluss_gemäß_§_10_Abs._1_BauGB)_1-1324.pdf",
    "access_url": "https://nordstemmen.ratsinfomanagement.net/webservice/oparl/v1.1/body/1/files/UGhVM0hpd2NXNFdFcExjZVROT9b72xHNn3Tkc2AZOx_11klcoK_B2kd-IxKRGt1a/Beschlussvorlage_DS_54-2007_1._Ergaenzung.pdf",
    "mime_type": "application/pdf",
    "name": "Beschlussvorlage (Bebauungsplan Nr. 0125 \"Mahlerter Straße - Nord 2. Änderung;\n\nSatzungsbeschluss gemäß § 10 Abs. 1 BauGB)",
    "date": "2007-07-12",
    "downloaded_at": "2025-11-12T10:30:38.811Z"
  },
  "1-207": {
    "oparl_id": "1-207",
    "filename": "2007/2007-03-22_Beschlussvorlage_(Erlass_einer_Rechtsverordnung_über_die_Öffnung_der_Verkaufsstellen_aus_Anlass_des__9._Nordstemmer_Jahrmarktes_-_Erdbeer-_und_Spargelfest__am_10._Juni_2007)_1-207.pdf",
    "access_url": "https://nordstemmen.ratsinfomanagement.net/webservice/oparl/v1.1/body/1/files/UGhVM0hpd2NXNFdFcExjZa5VX9pS39LZJwzU9Ag6v5R_aXavyxCTA_GO_NyfvoGQ/Beschlussvorlage_DS_7-2007.pdf",
    "mime_type": "application/pdf",
    "name": "Beschlussvorlage (Erlass einer Rechtsverordnung über die Öffnung der Verkaufsstellen aus Anlass des\n\"9. Nordstemmer Jahrmarktes - Erdbeer- und Spargelfest\" am 10. Juni 2007)",
    "date": "2007-03-22",
    "downloaded_at": "2025-11-12T10:30:38.817Z"
  },
  "1-258": {
    "oparl_id": "1-258",
    "filename": "2007/2007-03-05_Bekanntmachung_(Ortsrat_Burgstemmen)_1-258.pdf",
    "access_url": "https://nordstemmen.ratsinfomanagement.net/webservice/oparl/v1.1/body/1/files/UGhVM0hpd2NXNFdFcExjZes33zzy4W_A6DblCs9WYoCJdISQrxW6SWcjPT_n7ufq/Bekanntmachung_Ortsrat_Burgstemmen_05.03.2007.pdf",
    "mime_type": "application/pdf",
    "name": "Bekanntmachung (Ortsrat Burgstemmen)",
    "date": "2007-03-05",
    "downloaded_at": "2025-11-12T10:30:38.826Z"
  },
  "1-1192": {
    "oparl_id": "1-1192",
    "filename": "2007/2007-07-12_Bekanntmachung_(Rat)_1-1192.pdf",
    "access_url": "https://nordstemmen.ratsinfomanagement.net/webservice/oparl/v1.1/body/1/files/UGhVM0hpd2NXNFdFcExjZXq50Jws0Kn5TfFgtYVW9ps4jYnNLpYGKUKzPcQlPfqv/Bekanntmachung_Rat_12.07.2007.pdf",
    "mime_type": "application/pdf",
    "name": "Bekanntmachung (Rat)",
    "date": "2007-07-12",
    "downloaded_at": "2025-11-12T10:30:38.826Z"
  },
  "1-1062": {
    "oparl_id": "1-1062",
    "filename": "2007/2007-06-19_Bekanntmachung_(Ortsrat_Rössing)_1-1062.pdf",
    "access_url": "https://nordstemmen.ratsinfomanagement.net/webservice/oparl/v1.1/body/1/files/UGhVM0hpd2NXNFdFcExjZbwocO9MOk9bLfmd-j6EGaBE8nY6svERxPbeX2oYNsWM/Bekanntmachung_Ortsrat_Roessing_19.06.2007.pdf",
    "mime_type": "application/pdf",
    "name": "Bekanntmachung (Ortsrat Rössing)",
    "date": "2007-06-19",
    "downloaded_at": "2025-11-12T10:30:38.833Z"
  },
  "1-235": {
    "oparl_id": "1-235",
    "filename": "2007/2007-03-06_Beschlussvorlage_(Anhörung_des_Ortsrates_zum_Haushaltsplan_2007_und_zum_Investitionsprogramm_für_den_Investitionszeitraum_bis_zum_Haushaltsjahr_2010_unter_Fortschreibung_des_Haushaltssi.pdf",
    "access_url": "https://nordstemmen.ratsinfomanagement.net/webservice/oparl/v1.1/body/1/files/UGhVM0hpd2NXNFdFcExjZQTGNml1PYmYQUby2Is5ScZcLn-BilK6XfJhFy8NKMpT/Beschlussvorlage_DS_13-2007.pdf",
    "mime_type": "application/pdf",
    "name": "Beschlussvorlage (Anhörung des Ortsrates zum Haushaltsplan 2007 und zum Investitionsprogramm für den Investitionszeitraum bis zum Haushaltsjahr 2010 unter Fortschreibung des Haushaltssicherungskonzeptes)",
    "date": "2007-03-06",
    "downloaded_at": "2025-11-12T10:30:38.833Z"
  },
  "1-252": {
    "oparl_id": "1-252",
    "filename": "2007/2007-03-05_Bekanntmachung_(Ortsrat_Adensen)_1-252.pdf",
    "access_url": "https://nordstemmen.ratsinfomanagement.net/webservice/oparl/v1.1/body/1/files/UGhVM0hpd2NXNFdFcExjZcvxCmhNYNEoWQBsU9vau9IyOhYcH-UZWYB7juUgHZJk/Bekanntmachung_Ortsrat_Adensen_05.03.2007.pdf",
    "mime_type": "application/pdf",
    "name": "Bekanntmachung (Ortsrat Adensen)",
    "date": "2007-03-05",
    "downloaded_at": "2025-11-12T10:30:38.849Z"
  },
  "1-244": {
    "oparl_id": "1-244",
    "filename": "2007/2007-03-01_Bekanntmachung_(Ortsrat_Groß_Escherde)_1-244.pdf",
    "access_url": "https://nordstemmen.ratsinfomanagement.net/webservice/oparl/v1.1/body/1/files/UGhVM0hpd2NXNFdFcExjZTNDqYfssMuNX61VaT9JWiW6VBRQIqcvLT9ZlxjZdT_8/Bekanntmachung_Ortsrat_Gross_Escherde_01.03.2007.pdf",
    "mime_type": "application/pdf",
    "name": "Bekanntmachung (Ortsrat Groß Escherde)",
    "date": "2007-03-01",
    "downloaded_at": "2025-11-12T10:30:38.865Z"
  },
  "1-1079": {
    "oparl_id": "1-1079",
    "filename": "2007/2007-06-21_Bekanntmachung_(Ortsrat_Nordstemmen)_1-1079.pdf",
    "access_url": "https://nordstemmen.ratsinfomanagement.net/webservice/oparl/v1.1/body/1/files/UGhVM0hpd2NXNFdFcExjZVNr1YDq7ed_JURiH6EiQX8x8C086xc-w8pphAdo-Qu3/Bekanntmachung_Ortsrat_Nordstemmen_21.06.2007.pdf",
    "mime_type": "application/pdf",
    "name": "Bekanntmachung (Ortsrat Nordstemmen)",
    "date": "2007-06-21",
    "downloaded_at": "2025-11-12T10:30:39.125Z"
  },
  "1-218": {
    "oparl_id": "1-218",
    "filename": "2007/2007-02-28_Beschlussvorlage_(Anhörung_des_Ortsrates_zum_Haushaltsplan_2007_und_zum_Investitionsprogramm_für_den_Investitionszeitraum_bis_zum_Haushaltsjahr_2010_unter_Fortschreibung_des_Haushaltssi.pdf",
    "access_url": "https://nordstemmen.ratsinfomanagement.net/webservice/oparl/v1.1/body/1/files/UGhVM0hpd2NXNFdFcExjZUlQ19hh3OhglSwZCqgDK8ZkgFYrXy0SZiBciaAOpva8/Beschlussvorlage_DS_8-2007.pdf",
    "mime_type": "application/pdf",
    "name": "Beschlussvorlage (Anhörung des Ortsrates zum Haushaltsplan 2007 und zum Investitionsprogramm für den Investitionszeitraum bis zum Haushaltsjahr 2010 unter Fortschreibung des Haushaltssicherungskonzeptes)",
    "date": "2007-02-28",
    "downloaded_at": "2025-11-12T10:30:39.324Z"
  },
  "1-1081": {
    "oparl_id": "1-1081",
    "filename": "2007/2007-06-21_Bekanntmachung_(Ortsrat_Heyersum)_1-1081.pdf",
    "access_url": "https://nordstemmen.ratsinfomanagement.net/webservice/oparl/v1.1/body/1/files/UGhVM0hpd2NXNFdFcExjZSeFYwJPueYGZNSpg1c-ZNpNqT0L8hVeZ633z_SeFG5a/Bekanntmachung_Ortsrat_Heyersum_21.06.2007.pdf",
    "mime_type": "application/pdf",
    "name": "Bekanntmachung (Ortsrat Heyersum)",
    "date": "2007-06-21",
    "downloaded_at": "2025-11-12T10:30:39.343Z"
  },
  "1-1227": {
    "oparl_id": "1-1227",
    "filename": "2007/2007-07-12_Beschlussvorlage_(Auf_Antrag_der_Ratsfrau_Dr._Cornelia_Ott_vom_21.05.2007__Behandlung_des_Antrages_vom_KOMM_e._V._vom_01.03.2007_zum_Förderprogramm_„Familien_mit_Zukunft_-_Kinder_bilden.pdf",
    "access_url": "https://nordstemmen.ratsinfomanagement.net/webservice/oparl/v1.1/body/1/files/UGhVM0hpd2NXNFdFcExjZWbzgwWHjMGSOMClYFUgyQg5l2Ab5d49bTuuAJMk9ewz/Beschlussvorlage_DS_58-2007_1._Ergaenzung.pdf",
    "mime_type": "application/pdf",
    "name": "Beschlussvorlage (Auf Antrag der Ratsfrau Dr. Cornelia Ott vom 21.05.2007:\nBehandlung des Antrages vom KOMM e. V. vom 01.03.2007 zum Förderprogramm\n„Familien mit Zukunft - Kinder bilden und betreuen“)",
    "date": "2007-07-12",
    "downloaded_at": "2025-11-12T10:30:39.350Z"
  },
  "1-1075": {
    "oparl_id": "1-1075",
    "filename": "2007/2007-06-21_Bekanntmachung_(Ortsrat_Mahlerten)_1-1075.pdf",
    "access_url": "https://nordstemmen.ratsinfomanagement.net/webservice/oparl/v1.1/body/1/files/UGhVM0hpd2NXNFdFcExjZQ0R9ftvxVpM7RHfIwACSkCHpt7vTbnmVu2q3Jv3mfNI/Bekanntmachung_Ortsrat_Mahlerten_21.06.2007.pdf",
    "mime_type": "application/pdf",
    "name": "Bekanntmachung (Ortsrat Mahlerten)",
    "date": "2007-06-21",
    "downloaded_at": "2025-11-12T10:30:39.372Z"
  },
  "1-1083": {
    "oparl_id": "1-1083",
    "filename": "2007/2007-06-20_Bekanntmachung_(Ortsrat_Burgstemmen)_1-1083.pdf",
    "access_url": "https://nordstemmen.ratsinfomanagement.net/webservice/oparl/v1.1/body/1/files/UGhVM0hpd2NXNFdFcExjZezZVZppR9rII1YOSnogKidqNTb413Sv8f2xz5AtdvsN/Bekanntmachung_Ortsrat_Burgstemmen_20.06.2007.pdf",
    "mime_type": "application/pdf",
    "name": "Bekanntmachung (Ortsrat Burgstemmen)",
    "date": "2007-06-20",
    "downloaded_at": "2025-11-12T10:30:39.372Z"
  },
  "1-248": {
    "oparl_id": "1-248",
    "filename": "2007/2007-03-08_Beschlussvorlage_(Anhörung_des_Ortsrates_zum_Haushaltsplan_2007_und_zum_Investitionsprogramm_für_den_Investitionszeitraum_bis_zum_Haushaltsjahr_2010_unter_Fortschreibung_des_Haushaltssi.pdf",
    "access_url": "https://nordstemmen.ratsinfomanagement.net/webservice/oparl/v1.1/body/1/files/UGhVM0hpd2NXNFdFcExjZVTPe3QdgFagnmKGe1t1x6rdnblndC97CN-BYR-zJNcf/Beschlussvorlage_DS_16-2007.pdf",
    "mime_type": "application/pdf",
    "name": "Beschlussvorlage (Anhörung des Ortsrates zum Haushaltsplan 2007 und zum Investitionsprogramm für den Investitionszeitraum bis zum Haushaltsjahr 2010 unter Fortschreibung des Haushaltssicherungskonzeptes)",
    "date": "2007-03-08",
    "downloaded_at": "2025-11-12T10:30:39.383Z"
  },
  "1-1559": {
    "oparl_id": "1-1559",
    "filename": "2007/2007-09-06_Bekanntmachung_(Fachausschuss_Planung,_Bau,_Umwelt,_Feuerschutz)_1-1559.pdf",
    "access_url": "https://nordstemmen.ratsinfomanagement.net/webservice/oparl/v1.1/body/1/files/UGhVM0hpd2NXNFdFcExjZV0U97Kml0Nfc2dMUL8HzfP2NfJmEEnEYENVUgmqZ4f5/Bekanntmachung_Fachausschuss_Planung-_Bau-_Umwelt-_Feuerschutz_06.09.2007.pdf",
    "mime_type": "application/pdf",
    "name": "Bekanntmachung (Fachausschuss Planung, Bau, Umwelt, Feuerschutz)",
    "date": "2007-09-06",
    "downloaded_at": "2025-11-12T10:30:39.392Z"
  },
  "1-423": {
    "oparl_id": "1-423",
    "filename": "2007/2007-04-03_Beschlussvorlage_(Bebauungsplan_Nr._0125_„Mahlerter_Straße_Nord__1._Änderung,_Ortschaft_Nordstemmen_Vorstellung_einer_neuen_Konzeption_der_Fa._IGH,_Hildesheim,_für_den_Bereich_des_urspr.pdf",
    "access_url": "https://nordstemmen.ratsinfomanagement.net/webservice/oparl/v1.1/body/1/files/UGhVM0hpd2NXNFdFcExjZeojUF0EInv9eNM6bXh0KbzHMqKuIkzHqGD2D3J63Hzd/Beschlussvorlage_DS_25-2007.pdf",
    "mime_type": "application/pdf",
    "name": "Beschlussvorlage (Bebauungsplan Nr. 0125 „Mahlerter Straße Nord\" 1. Änderung, Ortschaft Nordstemmen\n\nVorstellung einer neuen Konzeption der Fa. IGH, Hildesheim, für den Bereich des ursprünglich geplanten Fitness-Centre)",
    "date": "2007-04-03",
    "downloaded_at": "2025-11-12T10:30:39.433Z"
  },
  "1-1561": {
    "oparl_id": "1-1561",
    "filename": "2007/2007-09-11_Bekanntmachung_(Fachausschuss_Schulen)_1-1561.pdf",
    "access_url": "https://nordstemmen.ratsinfomanagement.net/webservice/oparl/v1.1/body/1/files/UGhVM0hpd2NXNFdFcExjZQMz-4LHC1mqiLyc7hHZI6rUQ6enFe4aQWMkKzxuavpw/Bekanntmachung_Fachausschuss_Schulen_11.09.2007.pdf",
    "mime_type": "application/pdf",
    "name": "Bekanntmachung (Fachausschuss Schulen)",
    "date": "2007-09-11",
    "downloaded_at": "2025-11-12T10:30:39.436Z"
  },
  "1-993": {
    "oparl_id": "1-993",
    "filename": "2007/2007-06-18_Mitteilungsvorlage_(S-Bahn_Anschluss_Barnten;_Verbindung_von_Adensen__Hallerburg_und_Nordstemmen_nach_Barnten)_1-993.pdf",
    "access_url": "https://nordstemmen.ratsinfomanagement.net/webservice/oparl/v1.1/body/1/files/UGhVM0hpd2NXNFdFcExjZZaBasuUDGXWzl2OiveNenEZMNYTWhDKyCpVWlKW8iev/Mitteilungsvorlage_DS_48-2007.pdf",
    "mime_type": "application/pdf",
    "name": "Mitteilungsvorlage (S-Bahn Anschluss Barnten;\n\nVerbindung von Adensen/ Hallerburg und Nordstemmen nach Barnten)",
    "date": "2007-06-18",
    "downloaded_at": "2025-11-12T10:30:39.440Z"
  },
  "1-1578": {
    "oparl_id": "1-1578",
    "filename": "2007/2007-10-04_Bekanntmachung_(Fachausschuss_Planung,_Bau,_Umwelt,_Feuerschutz)_1-1578.pdf",
    "access_url": "https://nordstemmen.ratsinfomanagement.net/webservice/oparl/v1.1/body/1/files/UGhVM0hpd2NXNFdFcExjZa6NY1ruxGke_yyrEuqnKpc8BjWrTEYOvpzotm4P6ane/Bekanntmachung_Fachausschuss_Planung-_Bau-_Umwelt-_Feuerschutz_04.10.2007.pdf",
    "mime_type": "application/pdf",
    "name": "Bekanntmachung (Fachausschuss Planung, Bau, Umwelt, Feuerschutz)",
    "date": "2007-10-04",
    "downloaded_at": "2025-11-12T10:30:39.448Z"
  },
  "1-1071": {
    "oparl_id": "1-1071",
    "filename": "2007/2007-06-21_Beschlussvorlage_(Bebauungsplan_Nr._0120__Hauptstraße_-_Mitte_III,_Ortschaft_Nordstemmen_-_Anhörung_des_Ortsrates)_1-1071.pdf",
    "access_url": "https://nordstemmen.ratsinfomanagement.net/webservice/oparl/v1.1/body/1/files/UGhVM0hpd2NXNFdFcExjZauKGQ1o4Ew_gp-NUtpp50fzueOnJWybcSQ6A8amxbhO/Beschlussvorlage_DS_55-2007.pdf",
    "mime_type": "application/pdf",
    "name": "Beschlussvorlage (Bebauungsplan Nr. 0120 \"Hauptstraße - Mitte III, Ortschaft Nordstemmen\n\n- Anhörung des Ortsrates)",
    "date": "2007-06-21",
    "downloaded_at": "2025-11-12T10:30:39.450Z"
  },
  "1-1780": {
    "oparl_id": "1-1780",
    "filename": "2007/2007-11-12_Bekanntmachung_(Ortsrat_Adensen)_1-1780.pdf",
    "access_url": "https://nordstemmen.ratsinfomanagement.net/webservice/oparl/v1.1/body/1/files/UGhVM0hpd2NXNFdFcExjZbvWTP2ERVI7ehCuUug2DlXiPFtAbVlzHar0rePt15Ew/Bekanntmachung_Ortsrat_Adensen_12.11.2007.pdf",
    "mime_type": "application/pdf",
    "name": "Bekanntmachung (Ortsrat Adensen)",
    "date": "2007-11-12",
    "downloaded_at": "2025-11-12T10:30:39.517Z"
  },
  "1-1148": {
    "oparl_id": "1-1148",
    "filename": "2007/2007-06-28_Bekanntmachung_(Fachausschuss_Planung,_Bau,_Umwelt,_Feuerschutz)_1-1148.pdf",
    "access_url": "https://nordstemmen.ratsinfomanagement.net/webservice/oparl/v1.1/body/1/files/UGhVM0hpd2NXNFdFcExjZWGkxch2SDPTiGxJ043E8SbpezGxS5c_q1J2GKXDuMMi/Bekanntmachung_Fachausschuss_Planung-_Bau-_Umwelt-_Feuerschutz_28.06.2007.pdf",
    "mime_type": "application/pdf",
    "name": "Bekanntmachung (Fachausschuss Planung, Bau, Umwelt, Feuerschutz)",
    "date": "2007-06-28",
    "downloaded_at": "2025-11-12T10:30:39.527Z"
  },
  "1-1776": {
    "oparl_id": "1-1776",
    "filename": "2007/2007-11-13_Bekanntmachung_(Ortsrat_Mahlerten)_1-1776.pdf",
    "access_url": "https://nordstemmen.ratsinfomanagement.net/webservice/oparl/v1.1/body/1/files/UGhVM0hpd2NXNFdFcExjZYwx3GXH72ai7c0-2itvriFNdcjkAhmSp8YtKVxZT7zj/Bekanntmachung_Ortsrat_Mahlerten_13.11.2007.pdf",
    "mime_type": "application/pdf",
    "name": "Bekanntmachung (Ortsrat Mahlerten)",
    "date": "2007-11-13",
    "downloaded_at": "2025-11-12T10:30:39.583Z"
  },
  "1-1773": {
    "oparl_id": "1-1773",
    "filename": "2007/2007-11-07_Bekanntmachung_(Ortsrat_Barnten)_1-1773.pdf",
    "access_url": "https://nordstemmen.ratsinfomanagement.net/webservice/oparl/v1.1/body/1/files/UGhVM0hpd2NXNFdFcExjZTIQbGfkop0hfONRnWn0P-uIUqCcHrFjWV17uskyXdhc/Bekanntmachung_Ortsrat_Barnten_07.11.2007.pdf",
    "mime_type": "application/pdf",
    "name": "Bekanntmachung (Ortsrat Barnten)",
    "date": "2007-11-07",
    "downloaded_at": "2025-11-12T10:30:39.584Z"
  },
  "1-1775": {
    "oparl_id": "1-1775",
    "filename": "2007/2007-11-07_Bekanntmachung_(Ortsrat_Rössing)_1-1775.pdf",
    "access_url": "https://nordstemmen.ratsinfomanagement.net/webservice/oparl/v1.1/body/1/files/UGhVM0hpd2NXNFdFcExjZdyOLaWbI9ktkFhWkeEZHVeHMB_WYRTjp25xvfnRgEhQ/Bekanntmachung_Ortsrat_Roessing_07.11.2007.pdf",
    "mime_type": "application/pdf",
    "name": "Bekanntmachung (Ortsrat Rössing)",
    "date": "2007-11-07",
    "downloaded_at": "2025-11-12T10:30:39.584Z"
  },
  "1-1096": {
    "oparl_id": "1-1096",
    "filename": "2007/2007-06-28_Beschlussvorlage_(Bebauungsplan_Nr._0125__Mahlerter_Straße_-_Nord_,_1._Änderung,_Ortschaft_Nordstemmen_-_Änderung_des_bisherigen_Aufstellungsbeschlusses)_1-1096.pdf",
    "access_url": "https://nordstemmen.ratsinfomanagement.net/webservice/oparl/v1.1/body/1/files/UGhVM0hpd2NXNFdFcExjZU6nzgpgDTlC6ctExczatA1PIq_uwdelMc8nFzTfUEBG/Beschlussvorlage_DS_51-2007.pdf",
    "mime_type": "application/pdf",
    "name": "Beschlussvorlage (Bebauungsplan Nr. 0125 \"Mahlerter Straße - Nord\", 1. Änderung, Ortschaft Nordstemmen\n\n- Änderung des bisherigen Aufstellungsbeschlusses)",
    "date": "2007-06-28",
    "downloaded_at": "2025-11-12T10:30:39.585Z"
  },
  "1-1117": {
    "oparl_id": "1-1117",
    "filename": "2007/2007-07-12_Beschlussvorlage_(Bebauungsplan_Nr._0506__Groß_Escherde_Ost__öffentliche_Auslegung)_1-1117.pdf",
    "access_url": "https://nordstemmen.ratsinfomanagement.net/webservice/oparl/v1.1/body/1/files/UGhVM0hpd2NXNFdFcExjZR3-Zib5AehAotN-Ed3ImKzdZAQ6Ng8X778ZKZjn-ZDl/Beschlussvorlage_DS_53-2007.pdf",
    "mime_type": "application/pdf",
    "name": "Beschlussvorlage (Bebauungsplan Nr. 0506 \"Groß Escherde Ost\"\n\nöffentliche Auslegung)",
    "date": "2007-07-12",
    "downloaded_at": "2025-11-12T10:30:39.597Z"
  },
  "1-1579": {
    "oparl_id": "1-1579",
    "filename": "2007/2007-10-18_Bekanntmachung_(Rat)_1-1579.pdf",
    "access_url": "https://nordstemmen.ratsinfomanagement.net/webservice/oparl/v1.1/body/1/files/UGhVM0hpd2NXNFdFcExjZaJOAB9Xf9Zxm9PFH42iJ99cqReiElQ-eOY36tcqDtej/Bekanntmachung_Rat_18.10.2007.pdf",
    "mime_type": "application/pdf",
    "name": "Bekanntmachung (Rat)",
    "date": "2007-10-18",
    "downloaded_at": "2025-11-12T10:30:39.600Z"
  },
  "1-1646": {
    "oparl_id": "1-1646",
    "filename": "2007/2007-10-18_Beschlussvorlage_(Bebauungsplan_Nr._0506__Groß_Escherde_Ost__öffentliche_Auslegung)_1-1646.pdf",
    "access_url": "https://nordstemmen.ratsinfomanagement.net/webservice/oparl/v1.1/body/1/files/UGhVM0hpd2NXNFdFcExjZeP58awIo1XNX1r26fhZTCH4ElxpUbwq9R2ABif7DqtT/Beschlussvorlage_DS_53-2007_2._Ergaenzung.pdf",
    "mime_type": "application/pdf",
    "name": "Beschlussvorlage (Bebauungsplan Nr. 0506 \"Groß Escherde Ost\"\n\nöffentliche Auslegung)",
    "date": "2007-10-18",
    "downloaded_at": "2025-11-12T10:30:39.601Z"
  },
  "1-1778": {
    "oparl_id": "1-1778",
    "filename": "2007/2007-11-13_Bekanntmachung_(Ortsrat_Heyersum)_1-1778.pdf",
    "access_url": "https://nordstemmen.ratsinfomanagement.net/webservice/oparl/v1.1/body/1/files/UGhVM0hpd2NXNFdFcExjZfWvAKnM-HbEpYxeQuMKXB5oPRyLb8pHwWoOq-8v4I7I/Bekanntmachung_Ortsrat_Heyersum_13.11.2007.pdf",
    "mime_type": "application/pdf",
    "name": "Bekanntmachung (Ortsrat Heyersum)",
    "date": "2007-11-13",
    "downloaded_at": "2025-11-12T10:30:39.607Z"
  },
  "1-1793": {
    "oparl_id": "1-1793",
    "filename": "2007/2007-11-14_Bekanntmachung_(Ortsrat_Nordstemmen)_1-1793.pdf",
    "access_url": "https://nordstemmen.ratsinfomanagement.net/webservice/oparl/v1.1/body/1/files/UGhVM0hpd2NXNFdFcExjZZPCiFkfnAtOn08CLoYqzTpsUmMHmH5DkMMFlHLrArJ8/Bekanntmachung_Ortsrat_Nordstemmen_14.11.2007.pdf",
    "mime_type": "application/pdf",
    "name": "Bekanntmachung (Ortsrat Nordstemmen)",
    "date": "2007-11-14",
    "downloaded_at": "2025-11-12T10:30:39.616Z"
  },
  "1-1783": {
    "oparl_id": "1-1783",
    "filename": "2007/2007-11-12_Bekanntmachung_(Ortsrat_Burgstemmen)_1-1783.pdf",
    "access_url": "https://nordstemmen.ratsinfomanagement.net/webservice/oparl/v1.1/body/1/files/UGhVM0hpd2NXNFdFcExjZYwbGN88twjV4h00H0zw27wRUl6JwGp9mMCPL2aEhukL/Bekanntmachung_Ortsrat_Burgstemmen_12.11.2007.pdf",
    "mime_type": "application/pdf",
    "name": "Bekanntmachung (Ortsrat Burgstemmen)",
    "date": "2007-11-12",
    "downloaded_at": "2025-11-12T10:30:39.633Z"
  },
  "1-1840": {
    "oparl_id": "1-1840",
    "filename": "2007/2007-11-15_Bekanntmachung_(Ortsrat_Groß_Escherde)_1-1840.pdf",
    "access_url": "https://nordstemmen.ratsinfomanagement.net/webservice/oparl/v1.1/body/1/files/UGhVM0hpd2NXNFdFcExjZaSqO43UH2meKcdsflY4oi1fk-jJURy30bbiM1zkVVDz/Bekanntmachung_Ortsrat_Gross_Escherde_15.11.2007.pdf",
    "mime_type": "application/pdf",
    "name": "Bekanntmachung (Ortsrat Groß Escherde)",
    "date": "2007-11-15",
    "downloaded_at": "2025-11-12T10:30:39.647Z"
  },
  "1-1815": {
    "oparl_id": "1-1815",
    "filename": "2007/2007-11-15_Bekanntmachung_(Ortsrat_Klein_Escherde)_1-1815.pdf",
    "access_url": "https://nordstemmen.ratsinfomanagement.net/webservice/oparl/v1.1/body/1/files/UGhVM0hpd2NXNFdFcExjZfWFNvKwgDsH-5Vo8NeGH3VbpVO1YmtsCQRbKmrvmF_6/Bekanntmachung_Ortsrat_Klein_Escherde_15.11.2007.pdf",
    "mime_type": "application/pdf",
    "name": "Bekanntmachung (Ortsrat Klein Escherde)",
    "date": "2007-11-15",
    "downloaded_at": "2025-11-12T10:30:39.690Z"
  },
  "1-1558": {
    "oparl_id": "1-1558",
    "filename": "2007/2007-08-09_Bekanntmachung_(Fachausschuss_Planung,_Bau,_Umwelt,_Feuerschutz)_1-1558.pdf",
    "access_url": "https://nordstemmen.ratsinfomanagement.net/webservice/oparl/v1.1/body/1/files/UGhVM0hpd2NXNFdFcExjZaHcSOzvJ1g8qxoZOx7lDocFGWeKhyYnoL9lb1iT4oUI/Bekanntmachung_Fachausschuss_Planung-_Bau-_Umwelt-_Feuerschutz_09.08.2007.pdf",
    "mime_type": "application/pdf",
    "name": "Bekanntmachung (Fachausschuss Planung, Bau, Umwelt, Feuerschutz)",
    "date": "2007-08-09",
    "downloaded_at": "2025-11-12T10:30:39.753Z"
  },
  "1-1068": {
    "oparl_id": "1-1068",
    "filename": "2007/2007-07-12_Beschlussvorlage_(Bebauungsplan_Nr._0411__Mühlenweg_-_Poppenburg_,_Ortschaft_Burgstemmen_öffentliche_Auslegung)_1-1068.pdf",
    "access_url": "https://nordstemmen.ratsinfomanagement.net/webservice/oparl/v1.1/body/1/files/UGhVM0hpd2NXNFdFcExjZQEIAxca-P6LciU8UiQ3ROuonuFuk74Em393CARAuRXe/Beschlussvorlage_DS_49-2007.pdf",
    "mime_type": "application/pdf",
    "name": "Beschlussvorlage (Bebauungsplan Nr. 0411 \"Mühlenweg - Poppenburg\", Ortschaft Burgstemmen\n\nöffentliche Auslegung)",
    "date": "2007-07-12",
    "downloaded_at": "2025-11-12T10:30:39.778Z"
  },
  "1-1087": {
    "oparl_id": "1-1087",
    "filename": "2007/2007-07-12_Beschlussvorlage_(Resolution_der_Gemeinde_Nordstemmen_zur_Anbindung_der_Ortschaften_Adensen_und_Hallerburg_an_den_ÖPNV_im_Landkreis_Hildesheim)_1-1087.pdf",
    "access_url": "https://nordstemmen.ratsinfomanagement.net/webservice/oparl/v1.1/body/1/files/UGhVM0hpd2NXNFdFcExjZShciYXUTPq57rLhMwLQnS2awfROfG3khILc--QE4A8k/Beschlussvorlage_DS_45-2007_1._Ergaenzung.pdf",
    "mime_type": "application/pdf",
    "name": "Beschlussvorlage (Resolution der Gemeinde Nordstemmen zur Anbindung der Ortschaften Adensen und Hallerburg an den ÖPNV im Landkreis Hildesheim)",
    "date": "2007-07-12",
    "downloaded_at": "2025-11-12T10:30:39.792Z"
  },
  "1-1101": {
    "oparl_id": "1-1101",
    "filename": "2007/2007-07-12_Beschlussvorlage_(Beheizungskonzept_für_das_Freizeitbad_und_den_Bauhof)_1-1101.pdf",
    "access_url": "https://nordstemmen.ratsinfomanagement.net/webservice/oparl/v1.1/body/1/files/UGhVM0hpd2NXNFdFcExjZVm02N_7lS1Khcpjy6468O-z6PYLVJkSQxZPoHm8CBZU/Beschlussvorlage_DS_57-2007.pdf",
    "mime_type": "application/pdf",
    "name": "Beschlussvorlage (Beheizungskonzept für das Freizeitbad und den Bauhof)",
    "date": "2007-07-12",
    "downloaded_at": "2025-11-12T10:30:39.821Z"
  },
  "1-1847": {
    "oparl_id": "1-1847",
    "filename": "2007/2007-11-19_Bekanntmachung_(Fachausschuss_Planung,_Bau,_Umwelt,_Feuerschutz)_1-1847.pdf",
    "access_url": "https://nordstemmen.ratsinfomanagement.net/webservice/oparl/v1.1/body/1/files/UGhVM0hpd2NXNFdFcExjZWDHpK5xiafJsQiwsDb0Np3cwg89gIorlQLL1cGXqQZ8/Bekanntmachung_Fachausschuss_Planung-_Bau-_Umwelt-_Feuerschutz_19.11.2007.pdf",
    "mime_type": "application/pdf",
    "name": "Bekanntmachung (Fachausschuss Planung, Bau, Umwelt, Feuerschutz)",
    "date": "2007-11-19",
    "downloaded_at": "2025-11-12T10:30:39.843Z"
  },
  "1-1853": {
    "oparl_id": "1-1853",
    "filename": "2007/2007-11-22_Bekanntmachung_(Fachausschuss_Finanzen,_Wirtschaftsförderung_und_Marketing)_1-1853.pdf",
    "access_url": "https://nordstemmen.ratsinfomanagement.net/webservice/oparl/v1.1/body/1/files/UGhVM0hpd2NXNFdFcExjZQ3wUpOdDMXavZgu7PLqe3uGh4cl7Wg_nwAGUnF43gcD/Bekanntmachung_Fachausschuss_Finanzen-_Wirtschaftsfoerderung_und_Marketing_22.11.2007.pdf",
    "mime_type": "application/pdf",
    "name": "Bekanntmachung (Fachausschuss Finanzen, Wirtschaftsförderung und Marketing)",
    "date": "2007-11-22",
    "downloaded_at": "2025-11-12T10:30:39.852Z"
  },
  "1-1120": {
    "oparl_id": "1-1120",
    "filename": "2007/2007-07-12_Beschlussvorlage_(Bebauungsplan_Nr._0125__Mahlerter_Straße_-_Nord_2._Änderung;_Satzungsbschluss_gemäß_§_10_Abs._1_BauGB)_1-1120.pdf",
    "access_url": "https://nordstemmen.ratsinfomanagement.net/webservice/oparl/v1.1/body/1/files/UGhVM0hpd2NXNFdFcExjZbgPcs23csE5tRB_KXx4scz5nkeqFndXxYRnNZ4QRwN4/Beschlussvorlage_DS_54-2007.pdf",
    "mime_type": "application/pdf",
    "name": "Beschlussvorlage (Bebauungsplan Nr. 0125 \"Mahlerter Straße - Nord 2. Änderung;\n\nSatzungsbschluss gemäß § 10 Abs. 1 BauGB)",
    "date": "2007-07-12",
    "downloaded_at": "2025-11-12T10:30:39.905Z"
  },
  "1-557": {
    "oparl_id": "1-557",
    "filename": "2007/2007-06-14_Beschlussvorlage_(Dienstanweisung_über_Stundung,_Niederschlagung_und_Erlass_von_Forderungen_der_Gemeinde_Nordstemmen)_1-557.pdf",
    "access_url": "https://nordstemmen.ratsinfomanagement.net/webservice/oparl/v1.1/body/1/files/UGhVM0hpd2NXNFdFcExjZSiuG4fWbMOTFwXPym8tDyUcrQQMEn468BnT-eGBasxr/Beschlussvorlage_DS_38-2007.pdf",
    "mime_type": "application/pdf",
    "name": "Beschlussvorlage (Dienstanweisung über Stundung, Niederschlagung und Erlass von Forderungen der Gemeinde Nordstemmen)",
    "date": "2007-06-14",
    "downloaded_at": "2025-11-12T10:30:40.122Z"
  },
  "1-563": {
    "oparl_id": "1-563",
    "filename": "2007/2007-06-14_Beschlussvorlage_(Über-_und_außerplanmäßige_Ausgaben_nach_§_89_Abs._1_NGO)_1-563.pdf",
    "access_url": "https://nordstemmen.ratsinfomanagement.net/webservice/oparl/v1.1/body/1/files/UGhVM0hpd2NXNFdFcExjZZJA6wxmnS3kSjA9SWt7V0Dlsf8ZxZT2YjDR9zO8mIsp/Beschlussvorlage_DS_40-2007.pdf",
    "mime_type": "application/pdf",
    "name": "Beschlussvorlage (Über- und außerplanmäßige Ausgaben nach § 89 Abs. 1 NGO)",
    "date": "2007-06-14",
    "downloaded_at": "2025-11-12T10:30:40.123Z"
  },
  "1-1151": {
    "oparl_id": "1-1151",
    "filename": "2007/2007-07-12_Beschlussvorlage_(Auf_Antrag_der_Ratsfrau_Dr._Cornelia_Ott_vom_21.05.2007__Behandlung_des_Antrages_vom_KOMM_e._V._vom_01.03.2007_zum_Förderprogramm_„Familien_mit_Zukunft_-_Kinder_bilden.pdf",
    "access_url": "https://nordstemmen.ratsinfomanagement.net/webservice/oparl/v1.1/body/1/files/UGhVM0hpd2NXNFdFcExjZdrTxX0dgTMEBhzaRBvy_xBjbEOkmRJO8lBcazrwlQtd/Beschlussvorlage_DS_58-2007.pdf",
    "mime_type": "application/pdf",
    "name": "Beschlussvorlage (Auf Antrag der Ratsfrau Dr. Cornelia Ott vom 21.05.2007:\nBehandlung des Antrages vom KOMM e. V. vom 01.03.2007 zum Förderprogramm\n„Familien mit Zukunft - Kinder bilden und betreuen)",
    "date": "2007-07-12",
    "downloaded_at": "2025-11-12T10:30:40.123Z"
  },
  "1-1174": {
    "oparl_id": "1-1174",
    "filename": "2007/2007-07-12_Beschlussvorlage_(Fortschreibung_des_Nahverkehrsplanes_für_den_Landkreis_Hildesheim)_1-1174.pdf",
    "access_url": "https://nordstemmen.ratsinfomanagement.net/webservice/oparl/v1.1/body/1/files/UGhVM0hpd2NXNFdFcExjZQOpShmRpPHYC8Rl8F-7fxGjrsPV3JmHO1gQX9OTrhTk/Beschlussvorlage_DS_59-2007.pdf",
    "mime_type": "application/pdf",
    "name": "Beschlussvorlage (Fortschreibung des Nahverkehrsplanes für den Landkreis Hildesheim)",
    "date": "2007-07-12",
    "downloaded_at": "2025-11-12T10:30:40.123Z"
  },
  "1-554": {
    "oparl_id": "1-554",
    "filename": "2007/2007-06-14_Beschlussvorlage_(Beschlussfassung_über_die_Jahresrechnung_2005_und_über_die_Entlastung_des_Bürgermeisters_gemäß_§_101_Abs._1_NGO)_1-554.pdf",
    "access_url": "https://nordstemmen.ratsinfomanagement.net/webservice/oparl/v1.1/body/1/files/UGhVM0hpd2NXNFdFcExjZU1u9SjYDpiRun6uus7gsoTnEORbY9Eaxgq8xb4vmKUH/Beschlussvorlage_DS_36-2007.pdf",
    "mime_type": "application/pdf",
    "name": "Beschlussvorlage (Beschlussfassung über die Jahresrechnung 2005 und über die Entlastung des Bürgermeisters gemäß § 101 Abs. 1 NGO)",
    "date": "2007-06-14",
    "downloaded_at": "2025-11-12T10:30:40.229Z"
  },
  "1-2255": {
    "oparl_id": "1-2255",
    "filename": "2008/2008-02-12_Bekanntmachung_(Ortsrat_Adensen)_1-2255.pdf",
    "access_url": "https://nordstemmen.ratsinfomanagement.net/webservice/oparl/v1.1/body/1/files/UGhVM0hpd2NXNFdFcExjZdkUi2088ULeEYYPcT7WbI3gJR69RhM8rCUzuD8Hu7G0/Bekanntmachung_Ortsrat_Adensen_12.02.2008.pdf",
    "mime_type": "application/pdf",
    "name": "Bekanntmachung (Ortsrat Adensen)",
    "date": "2008-02-12",
    "downloaded_at": "2025-11-12T10:30:40.239Z"
  },
  "1-1112": {
    "oparl_id": "1-1112",
    "filename": "2007/2007-07-12_Beschlussvorlage_(14._Änderung_des_Flächennutzungsplanes_der_Gemeinde_Nordstemmen_(Wohnbauflächen_Groß_Escherde);_Feststellungsbeschluss)_1-1112.pdf",
    "access_url": "https://nordstemmen.ratsinfomanagement.net/webservice/oparl/v1.1/body/1/files/UGhVM0hpd2NXNFdFcExjZfBEljwJZxUHPD7nerNSi7aFxemKO4ed7G8ovzY2OZIa/Beschlussvorlage_DS_52-2007.pdf",
    "mime_type": "application/pdf",
    "name": "Beschlussvorlage (14. Änderung des Flächennutzungsplanes der Gemeinde Nordstemmen (Wohnbauflächen Groß Escherde);\n\nFeststellungsbeschluss)",
    "date": "2007-07-12",
    "downloaded_at": "2025-11-12T10:30:40.262Z"
  },
  "1-954": {
    "oparl_id": "1-954",
    "filename": "2007/2007-07-12_Beschlussvorlage_(Resolution_der_Gemeinde_Nordstemmen_zur_Anbindung_der_Ortschaften_Adensen_und_Hallerburg_an_den_ÖPNV_im_Landkreis_Hildesheim)_1-954.pdf",
    "access_url": "https://nordstemmen.ratsinfomanagement.net/webservice/oparl/v1.1/body/1/files/UGhVM0hpd2NXNFdFcExjZUDnmSPmIcwrTJDrjoSjc6EA8C4OycRyC7BBJFnieNRn/Beschlussvorlage_DS_45-2007.pdf",
    "mime_type": "application/pdf",
    "name": "Beschlussvorlage (Resolution der Gemeinde Nordstemmen zur Anbindung der Ortschaften Adensen und Hallerburg an den ÖPNV im Landkreis Hildesheim)",
    "date": "2007-07-12",
    "downloaded_at": "2025-11-12T10:30:40.279Z"
  },
  "1-2253": {
    "oparl_id": "1-2253",
    "filename": "2008/2008-02-12_Bekanntmachung_(Ortsrat_Burgstemmen)_1-2253.pdf",
    "access_url": "https://nordstemmen.ratsinfomanagement.net/webservice/oparl/v1.1/body/1/files/UGhVM0hpd2NXNFdFcExjZc7rGkOLBBqqt7p1HorciIeCYDUblG6pLeaYeWMBZx45/Bekanntmachung_Ortsrat_Burgstemmen_12.02.2008.pdf",
    "mime_type": "application/pdf",
    "name": "Bekanntmachung (Ortsrat Burgstemmen)",
    "date": "2008-02-12",
    "downloaded_at": "2025-11-12T10:30:40.284Z"
  },
  "1-566": {
    "oparl_id": "1-566",
    "filename": "2007/2007-06-14_Beschlussvorlage_(Richtlinien_für_die_Aufnahme_von_Krediten_nach_§_92_Abs._1_NGO)_1-566.pdf",
    "access_url": "https://nordstemmen.ratsinfomanagement.net/webservice/oparl/v1.1/body/1/files/UGhVM0hpd2NXNFdFcExjZULpy7W_BeyiLxzWqE2Sca5dydWFf0lEIN902zaZswOo/Beschlussvorlage_DS_41-2007.pdf",
    "mime_type": "application/pdf",
    "name": "Beschlussvorlage (Richtlinien für die Aufnahme von Krediten nach § 92 Abs. 1 NGO)",
    "date": "2007-06-14",
    "downloaded_at": "2025-11-12T10:30:40.298Z"
  },
  "1-2219": {
    "oparl_id": "1-2219",
    "filename": "2008/2008-03-06_Beschlussvorlage_(Investitionsprogramm_für_den_Investitionszeitraum_bis_zum_Haushaltsjahr_2011)_1-2219.pdf",
    "access_url": "https://nordstemmen.ratsinfomanagement.net/webservice/oparl/v1.1/body/1/files/UGhVM0hpd2NXNFdFcExjZSpLMkp9QFBq4eIESCstqGOn1A4Ze4YsrW36yGAkyl7C/Beschlussvorlage_DS_7-2008.pdf",
    "mime_type": "application/pdf",
    "name": "Beschlussvorlage (Investitionsprogramm für den Investitionszeitraum bis zum Haushaltsjahr 2011)",
    "date": "2008-03-06",
    "downloaded_at": "2025-11-12T10:30:40.422Z"
  },
  "1-2227": {
    "oparl_id": "1-2227",
    "filename": "2008/2008-03-06_Beschlussvorlage_(Haushaltssatzung_mit_Haushaltsplan_für_das_Haushaltsjahr_2008_unter_Fortschreibung_des_Haushaltssicherungskonzeptes)_1-2227.pdf",
    "access_url": "https://nordstemmen.ratsinfomanagement.net/webservice/oparl/v1.1/body/1/files/UGhVM0hpd2NXNFdFcExjZcZag7snuGR1zuh942eufGbOGYHztJP1v1txW0Jo5YSx/Beschlussvorlage_DS_9-2008.pdf",
    "mime_type": "application/pdf",
    "name": "Beschlussvorlage (Haushaltssatzung mit Haushaltsplan für das Haushaltsjahr 2008 unter Fortschreibung des Haushaltssicherungskonzeptes)",
    "date": "2008-03-06",
    "downloaded_at": "2025-11-12T10:30:40.447Z"
  },
  "1-2267": {
    "oparl_id": "1-2267",
    "filename": "2008/2008-02-18_Bekanntmachung_(Fachausschuss_Freizeit,_Kultur,_Jugend,_Soziales,_Demographie)_1-2267.pdf",
    "access_url": "https://nordstemmen.ratsinfomanagement.net/webservice/oparl/v1.1/body/1/files/UGhVM0hpd2NXNFdFcExjZQ0g0qXx67LgEh-20uEJt4_iwAuPkeONOiRHG31l6sxv/Bekanntmachung_Fachausschuss_Freizeit-_Kultur-_Jugend-_Soziales-_Demographie_18.02.2008.pdf",
    "mime_type": "application/pdf",
    "name": "Bekanntmachung (Fachausschuss Freizeit, Kultur, Jugend, Soziales, Demographie)",
    "date": "2008-02-18",
    "downloaded_at": "2025-11-12T10:30:40.482Z"
  },
  "1-2269": {
    "oparl_id": "1-2269",
    "filename": "2008/2008-02-14_Bekanntmachung_(Ortsrat_Barnten)_1-2269.pdf",
    "access_url": "https://nordstemmen.ratsinfomanagement.net/webservice/oparl/v1.1/body/1/files/UGhVM0hpd2NXNFdFcExjZahCjsOA-M7E1H-DNCzpk79iQz9d5O9h7GuqacbgLECv/Bekanntmachung_Ortsrat_Barnten_14.02.2008.pdf",
    "mime_type": "application/pdf",
    "name": "Bekanntmachung (Ortsrat Barnten)",
    "date": "2008-02-14",
    "downloaded_at": "2025-11-12T10:30:40.487Z"
  },
  "1-2146": {
    "oparl_id": "1-2146",
    "filename": "2008/2008-02-05_Beschlussvorlage_(Vergabe_von_Mäharbeiten_für_Sport-_und_Bolzplätze_sowie_für_die_Grünflächen_der_Gemeinde_Nordstemmen)_1-2146.pdf",
    "access_url": "https://nordstemmen.ratsinfomanagement.net/webservice/oparl/v1.1/body/1/files/UGhVM0hpd2NXNFdFcExjZcQI59_P7hu_oclMF4FMtmWTjcaeEKU5OJ46-VyFF_E_/Beschlussvorlage_DS_1-2008.pdf",
    "mime_type": "application/pdf",
    "name": "Beschlussvorlage (Vergabe von Mäharbeiten für Sport- und Bolzplätze sowie für die Grünflächen der Gemeinde Nordstemmen)",
    "date": "2008-02-05",
    "downloaded_at": "2025-11-12T10:30:40.487Z"
  },
  "1-2305": {
    "oparl_id": "1-2305",
    "filename": "2008/2008-02-21_Bekanntmachung_(Fachausschuss_Planung,_Bau,_Umwelt,_Feuerschutz)_1-2305.pdf",
    "access_url": "https://nordstemmen.ratsinfomanagement.net/webservice/oparl/v1.1/body/1/files/UGhVM0hpd2NXNFdFcExjZUaScaiyyxTMzk44WOKowranK61M-hwYjccXiv9biauy/Bekanntmachung_Fachausschuss_Planung-_Bau-_Umwelt-_Feuerschutz_21.02.2008.pdf",
    "mime_type": "application/pdf",
    "name": "Bekanntmachung (Fachausschuss Planung, Bau, Umwelt, Feuerschutz)",
    "date": "2008-02-21",
    "downloaded_at": "2025-11-12T10:30:40.487Z"
  },
  "1-2276": {
    "oparl_id": "1-2276",
    "filename": "2008/2008-03-06_Beschlussvorlage_(Ernennung_von_Führungskräften_der_Feuerwehr_unter_Berufung_in_das_Ehrenbeamtenverhältnis)_1-2276.pdf",
    "access_url": "https://nordstemmen.ratsinfomanagement.net/webservice/oparl/v1.1/body/1/files/UGhVM0hpd2NXNFdFcExjZezH48wn8unGhqJvaXACU6P6XAqC81MDB5lm0Y3mtfez/Beschlussvorlage_DS_12-2008.pdf",
    "mime_type": "application/pdf",
    "name": "Beschlussvorlage (Ernennung von Führungskräften der Feuerwehr unter Berufung in das Ehrenbeamtenverhältnis)",
    "date": "2008-03-06",
    "downloaded_at": "2025-11-12T10:30:40.536Z"
  },
  "1-2291": {
    "oparl_id": "1-2291",
    "filename": "2008/2008-02-19_Bekanntmachung_(Ortsrat_Klein_Escherde)_1-2291.pdf",
    "access_url": "https://nordstemmen.ratsinfomanagement.net/webservice/oparl/v1.1/body/1/files/UGhVM0hpd2NXNFdFcExjZU_TzICS76dEzr82GC9iPi22ARRXxYMHa0E7uNiZs3jg/Bekanntmachung_Ortsrat_Klein_Escherde_19.02.2008.pdf",
    "mime_type": "application/pdf",
    "name": "Bekanntmachung (Ortsrat Klein Escherde)",
    "date": "2008-02-19",
    "downloaded_at": "2025-11-12T10:30:40.567Z"
  },
  "1-2265": {
    "oparl_id": "1-2265",
    "filename": "2008/2008-02-13_Bekanntmachung_(Ortsrat_Rössing)_1-2265.pdf",
    "access_url": "https://nordstemmen.ratsinfomanagement.net/webservice/oparl/v1.1/body/1/files/UGhVM0hpd2NXNFdFcExjZWcp_pIRVJO8lRZX8YFGLO8gHCqVDdiy8giQn7Q23pqP/Bekanntmachung_Ortsrat_Roessing_13.02.2008.pdf",
    "mime_type": "application/pdf",
    "name": "Bekanntmachung (Ortsrat Rössing)",
    "date": "2008-02-13",
    "downloaded_at": "2025-11-12T10:30:40.567Z"
  },
  "1-2223": {
    "oparl_id": "1-2223",
    "filename": "2008/2008-03-06_Beschlussvorlage_(Fortschreibung_des_Haushaltssicherungskonzeptes_der_Gemeinde_Nordstemmen_zur_Haushaltssatzung_für_das_Haushaltsjahr_2008)_1-2223.pdf",
    "access_url": "https://nordstemmen.ratsinfomanagement.net/webservice/oparl/v1.1/body/1/files/UGhVM0hpd2NXNFdFcExjZaU7m7KqyS88cxcHpLlJLvlU1R2c6ogtoGKYq2oo6yjk/Beschlussvorlage_DS_8-2008.pdf",
    "mime_type": "application/pdf",
    "name": "Beschlussvorlage (Fortschreibung des Haushaltssicherungskonzeptes der Gemeinde Nordstemmen zur Haushaltssatzung für das Haushaltsjahr 2008)",
    "date": "2008-03-06",
    "downloaded_at": "2025-11-12T10:30:40.610Z"
  },
  "1-2303": {
    "oparl_id": "1-2303",
    "filename": "2008/2008-02-20_Bekanntmachung_(Fachausschuss_Finanzen,_Wirtschaftsförderung_und_Marketing)_1-2303.pdf",
    "access_url": "https://nordstemmen.ratsinfomanagement.net/webservice/oparl/v1.1/body/1/files/UGhVM0hpd2NXNFdFcExjZeqB1hWJOVgNtMykHV7hx-I7TIKcObHAchayB5t4bnMB/Bekanntmachung_Fachausschuss_Finanzen-_Wirtschaftsfoerderung_und_Marketing_20.02.2008.pdf",
    "mime_type": "application/pdf",
    "name": "Bekanntmachung (Fachausschuss Finanzen, Wirtschaftsförderung und Marketing)",
    "date": "2008-02-20",
    "downloaded_at": "2025-11-12T10:30:40.645Z"
  },
  "1-2340": {
    "oparl_id": "1-2340",
    "filename": "2008/2008-03-06_Bekanntmachung_(Rat)_1-2340.pdf",
    "access_url": "https://nordstemmen.ratsinfomanagement.net/webservice/oparl/v1.1/body/1/files/UGhVM0hpd2NXNFdFcExjZc32plWnCQT8LMZUWEOIekoq3Z5bncjuS1hy05qpUdy-/Bekanntmachung_Rat_06.03.2008.pdf",
    "mime_type": "application/pdf",
    "name": "Bekanntmachung (Rat)",
    "date": "2008-03-06",
    "downloaded_at": "2025-11-12T10:30:40.678Z"
  },
  "1-2473": {
    "oparl_id": "1-2473",
    "filename": "2008/2008-04-08_Bekanntmachung_(Ortsrat_Groß_Escherde)_1-2473.pdf",
    "access_url": "https://nordstemmen.ratsinfomanagement.net/webservice/oparl/v1.1/body/1/files/UGhVM0hpd2NXNFdFcExjZbIq-glnBn2fOTiocCZssm_m7WcowisqhUNYFtqimQ54/Bekanntmachung_Ortsrat_Gross_Escherde_08.04.2008.pdf",
    "mime_type": "application/pdf",
    "name": "Bekanntmachung (Ortsrat Groß Escherde)",
    "date": "2008-04-08",
    "downloaded_at": "2025-11-12T10:30:40.694Z"
  },
  "1-2263": {
    "oparl_id": "1-2263",
    "filename": "2008/2008-02-13_Bekanntmachung_(Ortsrat_Nordstemmen)_1-2263.pdf",
    "access_url": "https://nordstemmen.ratsinfomanagement.net/webservice/oparl/v1.1/body/1/files/UGhVM0hpd2NXNFdFcExjZXaQR-AA1c8hMCCF4nLACBT9ArkY9n0dT4uk5Aqid_sr/Bekanntmachung_Ortsrat_Nordstemmen_13.02.2008.pdf",
    "mime_type": "application/pdf",
    "name": "Bekanntmachung (Ortsrat Nordstemmen)",
    "date": "2008-02-13",
    "downloaded_at": "2025-11-12T10:30:40.710Z"
  },
  "1-2582": {
    "oparl_id": "1-2582",
    "filename": "2008/2008-05-19_Bekanntmachung_(Ortsrat_Nordstemmen)_1-2582.pdf",
    "access_url": "https://nordstemmen.ratsinfomanagement.net/webservice/oparl/v1.1/body/1/files/UGhVM0hpd2NXNFdFcExjZcIf5FJxRDltZzc8yQUcOtXH5vxMTOFxObA4tK-uezgt/Bekanntmachung_Ortsrat_Nordstemmen_19.05.2008.pdf",
    "mime_type": "application/pdf",
    "name": "Bekanntmachung (Ortsrat Nordstemmen)",
    "date": "2008-05-19",
    "downloaded_at": "2025-11-12T10:30:40.772Z"
  },
  "1-2346": {
    "oparl_id": "1-2346",
    "filename": "2008/2008-02-27_Bekanntmachung_(Ortsrat_Mahlerten)_1-2346.pdf",
    "access_url": "https://nordstemmen.ratsinfomanagement.net/webservice/oparl/v1.1/body/1/files/UGhVM0hpd2NXNFdFcExjZW0SeJlUu15Sr-GW4Ilm6ukJ2mo0Si7REY0V9iWVtDtC/Bekanntmachung_Ortsrat_Mahlerten_27.02.2008.pdf",
    "mime_type": "application/pdf",
    "name": "Bekanntmachung (Ortsrat Mahlerten)",
    "date": "2008-02-27",
    "downloaded_at": "2025-11-12T10:30:40.811Z"
  },
  "1-2307": {
    "oparl_id": "1-2307",
    "filename": "2008/2008-03-06_Beschlussvorlage_(Erweiterung_und_Sanierung_der_Kläranlage_Nordstemmen_sowie_künftige_Klärschlammbehandlung)_1-2307.pdf",
    "access_url": "https://nordstemmen.ratsinfomanagement.net/webservice/oparl/v1.1/body/1/files/UGhVM0hpd2NXNFdFcExjZfKdBlOa0A1uYPstH3P0iD59x4CmcpdwTYGKk2_hP_CL/Beschlussvorlage_DS_5-2008.pdf",
    "mime_type": "application/pdf",
    "name": "Beschlussvorlage (Erweiterung und Sanierung der Kläranlage Nordstemmen sowie künftige Klärschlammbehandlung)",
    "date": "2008-03-06",
    "downloaded_at": "2025-11-12T10:30:40.811Z"
  },
  "1-2584": {
    "oparl_id": "1-2584",
    "filename": "2008/2008-05-19_Bekanntmachung_(Ortsrat_Klein_Escherde)_1-2584.pdf",
    "access_url": "https://nordstemmen.ratsinfomanagement.net/webservice/oparl/v1.1/body/1/files/UGhVM0hpd2NXNFdFcExjZYQug0Ofez8BfyRiHkms4F3Ao9NAbw12ufoAzkQy0pMv/Bekanntmachung_Ortsrat_Klein_Escherde_19.05.2008.pdf",
    "mime_type": "application/pdf",
    "name": "Bekanntmachung (Ortsrat Klein Escherde)",
    "date": "2008-05-19",
    "downloaded_at": "2025-11-12T10:30:40.841Z"
  },
  "1-2614": {
    "oparl_id": "1-2614",
    "filename": "2008/2008-05-22_Bekanntmachung_(Ortsrat_Rössing)_1-2614.pdf",
    "access_url": "https://nordstemmen.ratsinfomanagement.net/webservice/oparl/v1.1/body/1/files/UGhVM0hpd2NXNFdFcExjZbwo1ZQi5MnLFpqyv8UKtPqMbX8bq-RtND_X97lsA4yX/Bekanntmachung_Ortsrat_Roessing_22.05.2008.pdf",
    "mime_type": "application/pdf",
    "name": "Bekanntmachung (Ortsrat Rössing)",
    "date": "2008-05-22",
    "downloaded_at": "2025-11-12T10:30:40.855Z"
  },
  "1-2624": {
    "oparl_id": "1-2624",
    "filename": "2008/2008-05-27_Bekanntmachung_(Ortsrat_Heyersum)_1-2624.pdf",
    "access_url": "https://nordstemmen.ratsinfomanagement.net/webservice/oparl/v1.1/body/1/files/UGhVM0hpd2NXNFdFcExjZaDcVIes_ot5Z11LjbvhEEXb0kwh1wYjriC4zzZfFQWT/Bekanntmachung_Ortsrat_Heyersum_27.05.2008.pdf",
    "mime_type": "application/pdf",
    "name": "Bekanntmachung (Ortsrat Heyersum)",
    "date": "2008-05-27",
    "downloaded_at": "2025-11-12T10:30:40.929Z"
  },
  "1-2612": {
    "oparl_id": "1-2612",
    "filename": "2008/2008-05-21_Bekanntmachung_(Ortsrat_Adensen)_1-2612.pdf",
    "access_url": "https://nordstemmen.ratsinfomanagement.net/webservice/oparl/v1.1/body/1/files/UGhVM0hpd2NXNFdFcExjZS78P6ru-JYrU0RW0yMozLD7SQfnOv8ofMmexDV0jNxu/Bekanntmachung_Ortsrat_Adensen_21.05.2008.pdf",
    "mime_type": "application/pdf",
    "name": "Bekanntmachung (Ortsrat Adensen)",
    "date": "2008-05-21",
    "downloaded_at": "2025-11-12T10:30:40.930Z"
  },
  "1-2640": {
    "oparl_id": "1-2640",
    "filename": "2008/2008-06-04_Bekanntmachung_(Fachausschuss_Planung,_Bau,_Umwelt,_Feuerschutz)_1-2640.pdf",
    "access_url": "https://nordstemmen.ratsinfomanagement.net/webservice/oparl/v1.1/body/1/files/UGhVM0hpd2NXNFdFcExjZe8dUL8MDglRk6h5lEx3gI9C_tzH3gSWZfw1NcySy-27/Bekanntmachung_Fachausschuss_Planung-_Bau-_Umwelt-_Feuerschutz_04.06.2008.pdf",
    "mime_type": "application/pdf",
    "name": "Bekanntmachung (Fachausschuss Planung, Bau, Umwelt, Feuerschutz)",
    "date": "2008-06-04",
    "downloaded_at": "2025-11-12T10:30:40.937Z"
  },
  "1-2673": {
    "oparl_id": "1-2673",
    "filename": "2008/2008-06-17_Bekanntmachung_(Fachausschuss_Finanzen,_Wirtschaftsförderung_und_Marketing)_1-2673.pdf",
    "access_url": "https://nordstemmen.ratsinfomanagement.net/webservice/oparl/v1.1/body/1/files/UGhVM0hpd2NXNFdFcExjZUU9qTSERlZQTQQ2DAGNAvS_SD346kSkqufWNJGvmY3V/Bekanntmachung_Fachausschuss_Finanzen-_Wirtschaftsfoerderung_und_Marketing_17.06.2008.pdf",
    "mime_type": "application/pdf",
    "name": "Bekanntmachung (Fachausschuss Finanzen, Wirtschaftsförderung und Marketing)",
    "date": "2008-06-17",
    "downloaded_at": "2025-11-12T10:30:40.947Z"
  },
  "1-2500": {
    "oparl_id": "1-2500",
    "filename": "2008/2008-07-08_Mitteilungsvorlage_(Unterrichtung_über_Haushaltsüberschreitungen_in_der_Zeit_vom_01.01._bis_31.12.2007_gemäß_§_89_Abs._1_NGO)_1-2500.pdf",
    "access_url": "https://nordstemmen.ratsinfomanagement.net/webservice/oparl/v1.1/body/1/files/UGhVM0hpd2NXNFdFcExjZW9PPf1Ag_8qewlnFmCGLBsk88PKSWzsbTcqPbjtJOtX/Mitteilungsvorlage_DS_19-2008.pdf",
    "mime_type": "application/pdf",
    "name": "Mitteilungsvorlage (Unterrichtung über Haushaltsüberschreitungen in der Zeit vom 01.01. bis 31.12.2007\ngemäß § 89 Abs. 1 NGO)",
    "date": "2008-07-08",
    "downloaded_at": "2025-11-12T10:30:41.018Z"
  },
  "1-2607": {
    "oparl_id": "1-2607",
    "filename": "2008/2008-07-08_Beschlussvorlage_(Verlängerung_des_Nordstemmer-Kinder-Bauland-Bonus)_1-2607.pdf",
    "access_url": "https://nordstemmen.ratsinfomanagement.net/webservice/oparl/v1.1/body/1/files/UGhVM0hpd2NXNFdFcExjZc9Rz3uVP2D2TmGg3HXH9PyAQ0B8GrKRHgZDZ7zuFlW9/Beschlussvorlage_DS_29-2008.pdf",
    "mime_type": "application/pdf",
    "name": "Beschlussvorlage (Verlängerung des Nordstemmer-Kinder-Bauland-Bonus)",
    "date": "2008-07-08",
    "downloaded_at": "2025-11-12T10:30:41.019Z"
  },
  "1-1109": {
    "oparl_id": "1-1109",
    "filename": "2007/2007-06-28_Beschlussvorlage_(Bebauungsplan_Nr._0107__Ortsmitte_-_Ost_,_5._Änderung,_Ortschaft_Nordstemmen_-_Änderung_des_bisherigen_Aufstellungsbeschlusses)_1-1109.pdf",
    "access_url": "https://nordstemmen.ratsinfomanagement.net/webservice/oparl/v1.1/body/1/files/UGhVM0hpd2NXNFdFcExjZa0KL61ocXNqjV4RQ07_MRe9LicKgPJFukYYBAaDtDN1/Beschlussvorlage_DS_56-2007.pdf",
    "mime_type": "application/pdf",
    "name": "Beschlussvorlage (Bebauungsplan Nr. 0107 \"Ortsmitte - Ost\", 5. Änderung, Ortschaft Nordstemmen\n\n- Änderung des bisherigen Aufstellungsbeschlusses)",
    "date": "2007-06-28",
    "downloaded_at": "2025-11-12T10:30:41.020Z"
  },
  "1-2616": {
    "oparl_id": "1-2616",
    "filename": "2008/2008-05-22_Bekanntmachung_(Ortsrat_Barnten)_1-2616.pdf",
    "access_url": "https://nordstemmen.ratsinfomanagement.net/webservice/oparl/v1.1/body/1/files/UGhVM0hpd2NXNFdFcExjZQCly84uCx3FA5MB549Vnu3GZwNXDv1aR-eHoErQBsO1/Bekanntmachung_Ortsrat_Barnten_22.05.2008.pdf",
    "mime_type": "application/pdf",
    "name": "Bekanntmachung (Ortsrat Barnten)",
    "date": "2008-05-22",
    "downloaded_at": "2025-11-12T10:30:41.022Z"
  },
  "1-2577": {
    "oparl_id": "1-2577",
    "filename": "2008/2008-07-08_Beschlussvorlage_(Neufassung_der_Satzung_über_die_Erhebung_von_Erschließungsbeiträgen_in_der_Gemeinde_Nordstemmen;_(Erschließungsbeitragssatzung_-_EBS))_1-2577.pdf",
    "access_url": "https://nordstemmen.ratsinfomanagement.net/webservice/oparl/v1.1/body/1/files/UGhVM0hpd2NXNFdFcExjZRFjYI81qaaPuNKE9s5EvxNoj6okEU9sUgrbYyDf-zLC/Beschlussvorlage_DS_22-2008.pdf",
    "mime_type": "application/pdf",
    "name": "Beschlussvorlage (Neufassung der Satzung über die Erhebung von Erschließungsbeiträgen in der\nGemeinde Nordstemmen;\n(Erschließungsbeitragssatzung - EBS))",
    "date": "2008-07-08",
    "downloaded_at": "2025-11-12T10:30:41.062Z"
  },
  "1-2634": {
    "oparl_id": "1-2634",
    "filename": "2008/2008-07-08_Beschlussvorlage_(Ev.-luth._Kindertagesstätte_in_der_Ortschaft_Nordstemmen;_-_Anbau_von_Räumlichkeiten_zur_Betreibung_einer_Krippengruppe)_1-2634.pdf",
    "access_url": "https://nordstemmen.ratsinfomanagement.net/webservice/oparl/v1.1/body/1/files/UGhVM0hpd2NXNFdFcExjZVLdhN9_d-6vRBv4r6pQRMtbjj_8MGUk4aIiR67j_fSw/Beschlussvorlage_DS_26-2008.pdf",
    "mime_type": "application/pdf",
    "name": "Beschlussvorlage (Ev.-luth. Kindertagesstätte in der Ortschaft Nordstemmen;\n- Anbau von Räumlichkeiten zur Betreibung einer Krippengruppe)",
    "date": "2008-07-08",
    "downloaded_at": "2025-11-12T10:30:41.065Z"
  },
  "1-2655": {
    "oparl_id": "1-2655",
    "filename": "2008/2008-07-08_Beschlussvorlage_(Beschlussfassung_über_die_Jahresrechnung_2006_und_über_die_Entlastung_des_Bürgermeisters_gemäß_§_101_Abs._1_NGO)_1-2655.pdf",
    "access_url": "https://nordstemmen.ratsinfomanagement.net/webservice/oparl/v1.1/body/1/files/UGhVM0hpd2NXNFdFcExjZY03ffgye6fXapsEscYfwTShzIjFu1cBfvRKcJDZXW13/Beschlussvorlage_DS_34-2008.pdf",
    "mime_type": "application/pdf",
    "name": "Beschlussvorlage (Beschlussfassung über die Jahresrechnung 2006 und über die Entlastung des Bürgermeisters gemäß § 101 Abs. 1 NGO)",
    "date": "2008-07-08",
    "downloaded_at": "2025-11-12T10:30:41.105Z"
  },
  "1-2503": {
    "oparl_id": "1-2503",
    "filename": "2008/2008-07-08_Mitteilungsvorlage_(Vorläufiges_Jahresergebnis_des_Haushaltsjahres_2007)_1-2503.pdf",
    "access_url": "https://nordstemmen.ratsinfomanagement.net/webservice/oparl/v1.1/body/1/files/UGhVM0hpd2NXNFdFcExjZZMSgaXjmR0xuX5g9a3EuRcrqdD7gLrjxf-1PI4JudpZ/Mitteilungsvorlage_DS_20-2008.pdf",
    "mime_type": "application/pdf",
    "name": "Mitteilungsvorlage (Vorläufiges Jahresergebnis des Haushaltsjahres 2007)",
    "date": "2008-07-08",
    "downloaded_at": "2025-11-12T10:30:41.122Z"
  },
  "1-2664": {
    "oparl_id": "1-2664",
    "filename": "2008/2008-06-10_Bekanntmachung_(Fachausschuss_Freizeit,_Kultur,_Jugend,_Soziales,_Demographie)_1-2664.pdf",
    "access_url": "https://nordstemmen.ratsinfomanagement.net/webservice/oparl/v1.1/body/1/files/UGhVM0hpd2NXNFdFcExjZQU8igZz_EUDU4uHx0vcgEOGAUz-17uTCoeuhxZUTNRL/Bekanntmachung_Fachausschuss_Freizeit-_Kultur-_Jugend-_Soziales-_Demographie_10.06.2008.pdf",
    "mime_type": "application/pdf",
    "name": "Bekanntmachung (Fachausschuss Freizeit, Kultur, Jugend, Soziales, Demographie)",
    "date": "2008-06-10",
    "downloaded_at": "2025-11-12T10:30:41.160Z"
  },
  "1-2770": {
    "oparl_id": "1-2770",
    "filename": "2008/2008-07-02_Bekanntmachung_(Fachausschuss_Planung,_Bau,_Umwelt,_Feuerschutz)_1-2770.pdf",
    "access_url": "https://nordstemmen.ratsinfomanagement.net/webservice/oparl/v1.1/body/1/files/UGhVM0hpd2NXNFdFcExjZfN69WvvYy1Ab6-viWye32PLSDPSJCRiH1vDxy7lwM3a/Bekanntmachung_Fachausschuss_Planung-_Bau-_Umwelt-_Feuerschutz_02.07.2008.pdf",
    "mime_type": "application/pdf",
    "name": "Bekanntmachung (Fachausschuss Planung, Bau, Umwelt, Feuerschutz)",
    "date": "2008-07-02",
    "downloaded_at": "2025-11-12T10:30:41.204Z"
  },
  "1-2598": {
    "oparl_id": "1-2598",
    "filename": "2008/2008-07-08_Beschlussvorlage_(Sanierung_Sportzentrum_Nordstemmen)_1-2598.pdf",
    "access_url": "https://nordstemmen.ratsinfomanagement.net/webservice/oparl/v1.1/body/1/files/UGhVM0hpd2NXNFdFcExjZSCSUVC-X94muQ5b4EQxOHmIJ5Egs-LOM7TqzrSCie3A/Beschlussvorlage_DS_25-2008.pdf",
    "mime_type": "application/pdf",
    "name": "Beschlussvorlage (Sanierung Sportzentrum Nordstemmen)",
    "date": "2008-07-08",
    "downloaded_at": "2025-11-12T10:30:41.308Z"
  },
  "1-2667": {
    "oparl_id": "1-2667",
    "filename": "2008/2008-07-08_Beschlussvorlage_(Erschließung_eines_Teilstückes_der_Straße__Jägerweg__in_der_Ortschaft_Rössing_-_Maßnahmenbeschluss)_1-2667.pdf",
    "access_url": "https://nordstemmen.ratsinfomanagement.net/webservice/oparl/v1.1/body/1/files/UGhVM0hpd2NXNFdFcExjZT7Uoey9s0iChyNzKBp38KJb3HG-cMe7i1vQhCslkk6j/Beschlussvorlage_DS_35-2008.pdf",
    "mime_type": "application/pdf",
    "name": "Beschlussvorlage (Erschließung eines Teilstückes der Straße \"Jägerweg\" in der Ortschaft Rössing - Maßnahmenbeschluss)",
    "date": "2008-07-08",
    "downloaded_at": "2025-11-12T10:30:41.407Z"
  },
  "1-2776": {
    "oparl_id": "1-2776",
    "filename": "2008/2008-07-08_Bekanntmachung_(Rat)_1-2776.pdf",
    "access_url": "https://nordstemmen.ratsinfomanagement.net/webservice/oparl/v1.1/body/1/files/UGhVM0hpd2NXNFdFcExjZdt237ESuSaSISCua2gWVB9EefQVAMa2vskoHZ0CFMV7/Bekanntmachung_Rat_08.07.2008.pdf",
    "mime_type": "application/pdf",
    "name": "Bekanntmachung (Rat)",
    "date": "2008-07-08",
    "downloaded_at": "2025-11-12T10:30:41.415Z"
  },
  "1-2603": {
    "oparl_id": "1-2603",
    "filename": "2008/2008-07-08_Beschlussvorlage_(Erlass_einer_Richtlinie_für_die_Arbeit_der_ehrenamtlichen_Gleichstellungsbeauftragten_in_der_Gemeinde_Nordstemmen)_1-2603.pdf",
    "access_url": "https://nordstemmen.ratsinfomanagement.net/webservice/oparl/v1.1/body/1/files/UGhVM0hpd2NXNFdFcExjZQYVuxII13xL-cgkkhZifFp3qJw3VxT8R-oZzz5cBsgg/Beschlussvorlage_DS_28-2008.pdf",
    "mime_type": "application/pdf",
    "name": "Beschlussvorlage (Erlass einer Richtlinie für die Arbeit der ehrenamtlichen Gleichstellungsbeauftragten in der Gemeinde Nordstemmen)",
    "date": "2008-07-08",
    "downloaded_at": "2025-11-12T10:30:41.433Z"
  },
  "1-2589": {
    "oparl_id": "1-2589",
    "filename": "2008/2008-07-08_Beschlussvorlage_(Neufassung_der_Satzung_der_Gemeinde_Nordstemmen_über_die_Erhebung_von_Beiträgen_nach_§_6_des_Niedersächsischen_Kommunalabgabengesetzes_(NKAG)_für_straßenbauliche_Maßna.pdf",
    "access_url": "https://nordstemmen.ratsinfomanagement.net/webservice/oparl/v1.1/body/1/files/UGhVM0hpd2NXNFdFcExjZWqbNOQz8mi56QVDrI5tI4N3T1UhNwNGpAAEwnUS7yrs/Beschlussvorlage_DS_23-2008.pdf",
    "mime_type": "application/pdf",
    "name": "Beschlussvorlage (Neufassung der Satzung der Gemeinde Nordstemmen über die Erhebung von Beiträgen nach § 6 des Niedersächsischen Kommunalabgabengesetzes (NKAG) für straßenbauliche Maßnahmen; (Straßenausbaubeitragssatzung - ABS))",
    "date": "2008-07-08",
    "downloaded_at": "2025-11-12T10:30:41.444Z"
  },
  "1-3214": {
    "oparl_id": "1-3214",
    "filename": "2008/2008-10-30_Bekanntmachung_(Ortsrat_Nordstemmen)_1-3214.pdf",
    "access_url": "https://nordstemmen.ratsinfomanagement.net/webservice/oparl/v1.1/body/1/files/UGhVM0hpd2NXNFdFcExjZWB6XCK0X4b4qnPaHQsPCKcqBlcQ53uvkNwhH6XwShIL/Bekanntmachung_Ortsrat_Nordstemmen_30.10.2008.pdf",
    "mime_type": "application/pdf",
    "name": "Bekanntmachung (Ortsrat Nordstemmen)",
    "date": "2008-10-30",
    "downloaded_at": "2025-11-12T10:30:41.446Z"
  },
  "1-2713": {
    "oparl_id": "1-2713",
    "filename": "2008/2008-06-18_Bekanntmachung_(Ortsrat_Mahlerten)_1-2713.pdf",
    "access_url": "https://nordstemmen.ratsinfomanagement.net/webservice/oparl/v1.1/body/1/files/UGhVM0hpd2NXNFdFcExjZRN4qsCJbtntmOYb6uLf_261R1Q4u91vq9iJ-9OIVPho/Bekanntmachung_Ortsrat_Mahlerten_18.06.2008.pdf",
    "mime_type": "application/pdf",
    "name": "Bekanntmachung (Ortsrat Mahlerten)",
    "date": "2008-06-18",
    "downloaded_at": "2025-11-12T10:30:41.479Z"
  },
  "1-3317": {
    "oparl_id": "1-3317",
    "filename": "2008/2008-11-17_Bekanntmachung_(Ortsrat_Burgstemmen)_1-3317.pdf",
    "access_url": "https://nordstemmen.ratsinfomanagement.net/webservice/oparl/v1.1/body/1/files/UGhVM0hpd2NXNFdFcExjZXCd9oLlGaZr5IOXJ_4eD0nx22AEAoaOXmbT6h0NDstQ/Bekanntmachung_Ortsrat_Burgstemmen_17.11.2008.pdf",
    "mime_type": "application/pdf",
    "name": "Bekanntmachung (Ortsrat Burgstemmen)",
    "date": "2008-11-17",
    "downloaded_at": "2025-11-12T10:30:41.479Z"
  },
  "1-3246": {
    "oparl_id": "1-3246",
    "filename": "2008/2008-11-06_Bekanntmachung_(Ortsrat_Mahlerten)_1-3246.pdf",
    "access_url": "https://nordstemmen.ratsinfomanagement.net/webservice/oparl/v1.1/body/1/files/UGhVM0hpd2NXNFdFcExjZcJDIMI25DJWZtglbPmbqnKzmU6076SvCnqdiVo-e32i/Bekanntmachung_Ortsrat_Mahlerten_06.11.2008.pdf",
    "mime_type": "application/pdf",
    "name": "Bekanntmachung (Ortsrat Mahlerten)",
    "date": "2008-11-06",
    "downloaded_at": "2025-11-12T10:30:41.479Z"
  },
  "1-3161": {
    "oparl_id": "1-3161",
    "filename": "2008/2008-10-09_Bekanntmachung_(Fachausschuss_Planung,_Bau,_Umwelt,_Feuerschutz)_1-3161.pdf",
    "access_url": "https://nordstemmen.ratsinfomanagement.net/webservice/oparl/v1.1/body/1/files/UGhVM0hpd2NXNFdFcExjZekep8yBAppdYatHLm5sJB5SvsP9--KKygpfvc0M3mrq/Bekanntmachung_Fachausschuss_Planung-_Bau-_Umwelt-_Feuerschutz_09.10.2008.pdf",
    "mime_type": "application/pdf",
    "name": "Bekanntmachung (Fachausschuss Planung, Bau, Umwelt, Feuerschutz)",
    "date": "2008-10-09",
    "downloaded_at": "2025-11-12T10:30:41.480Z"
  },
  "1-2651": {
    "oparl_id": "1-2651",
    "filename": "2008/2008-07-08_Beschlussvorlage_(Vorschlagsliste_für_die_Neuwahl_der_Schöffen_für_die_Jahre_2009_bis_2013)_1-2651.pdf",
    "access_url": "https://nordstemmen.ratsinfomanagement.net/webservice/oparl/v1.1/body/1/files/UGhVM0hpd2NXNFdFcExjZSSttWiLrp9nOnSC6RfitRor-kTUrzz56zWRnwMjpGJw/Beschlussvorlage_DS_33-2008.pdf",
    "mime_type": "application/pdf",
    "name": "Beschlussvorlage (Vorschlagsliste für die Neuwahl der Schöffen für die Jahre 2009 bis 2013)",
    "date": "2008-07-08",
    "downloaded_at": "2025-11-12T10:30:41.480Z"
  },
  "1-3288": {
    "oparl_id": "1-3288",
    "filename": "2008/2008-11-10_Bekanntmachung_(Ortsrat_Klein_Escherde)_1-3288.pdf",
    "access_url": "https://nordstemmen.ratsinfomanagement.net/webservice/oparl/v1.1/body/1/files/UGhVM0hpd2NXNFdFcExjZXzHW8W32MuhDBqY7BTMORyVyIFFFXNRMy2PR2WYAoCA/Bekanntmachung_Ortsrat_Klein_Escherde_10.11.2008.pdf",
    "mime_type": "application/pdf",
    "name": "Bekanntmachung (Ortsrat Klein Escherde)",
    "date": "2008-11-10",
    "downloaded_at": "2025-11-12T10:30:41.480Z"
  },
  "1-3292": {
    "oparl_id": "1-3292",
    "filename": "2008/2008-11-12_Bekanntmachung_(Ortsrat_Barnten)_1-3292.pdf",
    "access_url": "https://nordstemmen.ratsinfomanagement.net/webservice/oparl/v1.1/body/1/files/UGhVM0hpd2NXNFdFcExjZQN8zuY8m_wEFGeQ1hf5l4GcYShRLFpUjWiXe4SORyL6/Bekanntmachung_Ortsrat_Barnten_12.11.2008.pdf",
    "mime_type": "application/pdf",
    "name": "Bekanntmachung (Ortsrat Barnten)",
    "date": "2008-11-12",
    "downloaded_at": "2025-11-12T10:30:41.487Z"
  },
  "1-3260": {
    "oparl_id": "1-3260",
    "filename": "2008/2008-11-13_Bekanntmachung_(Rat)_1-3260.pdf",
    "access_url": "https://nordstemmen.ratsinfomanagement.net/webservice/oparl/v1.1/body/1/files/UGhVM0hpd2NXNFdFcExjZYqt5lz8wj9intRGcgND2hfk4m2RUyBljLmReqeL2IJ8/Bekanntmachung_Rat_13.11.2008.pdf",
    "mime_type": "application/pdf",
    "name": "Bekanntmachung (Rat)",
    "date": "2008-11-13",
    "downloaded_at": "2025-11-12T10:30:41.510Z"
  },
  "1-3212": {
    "oparl_id": "1-3212",
    "filename": "2008/2008-10-30_Bekanntmachung_(Ortsrat_Adensen)_1-3212.pdf",
    "access_url": "https://nordstemmen.ratsinfomanagement.net/webservice/oparl/v1.1/body/1/files/UGhVM0hpd2NXNFdFcExjZX7epE2Lhx8hVQ9gYVO96NSFMf8_AETk23CyMphmaQov/Bekanntmachung_Ortsrat_Adensen_30.10.2008.pdf",
    "mime_type": "application/pdf",
    "name": "Bekanntmachung (Ortsrat Adensen)",
    "date": "2008-10-30",
    "downloaded_at": "2025-11-12T10:30:41.537Z"
  },
  "1-3329": {
    "oparl_id": "1-3329",
    "filename": "2008/2008-11-18_Bekanntmachung_(Fachausschuss_Freizeit,_Kultur,_Jugend,_Soziales,_Demographie)_1-3329.pdf",
    "access_url": "https://nordstemmen.ratsinfomanagement.net/webservice/oparl/v1.1/body/1/files/UGhVM0hpd2NXNFdFcExjZV8KjcB_BAol7BARdJ3PV9mv2rwh0_LJ_fu1BKjuUYRI/Bekanntmachung_Fachausschuss_Freizeit-_Kultur-_Jugend-_Soziales-_Demographie_18.11.2008.pdf",
    "mime_type": "application/pdf",
    "name": "Bekanntmachung (Fachausschuss Freizeit, Kultur, Jugend, Soziales, Demographie)",
    "date": "2008-11-18",
    "downloaded_at": "2025-11-12T10:30:41.606Z"
  },
  "1-3290": {
    "oparl_id": "1-3290",
    "filename": "2008/2008-11-10_Bekanntmachung_(Ortsrat_Groß_Escherde)_1-3290.pdf",
    "access_url": "https://nordstemmen.ratsinfomanagement.net/webservice/oparl/v1.1/body/1/files/UGhVM0hpd2NXNFdFcExjZRum_Hey9xK_VC0OT0Qra1XEakPLFC765R_UBalbpsJq/Bekanntmachung_Ortsrat_Gross_Escherde_10.11.2008.pdf",
    "mime_type": "application/pdf",
    "name": "Bekanntmachung (Ortsrat Groß Escherde)",
    "date": "2008-11-10",
    "downloaded_at": "2025-11-12T10:30:41.607Z"
  },
  "1-3422": {
    "oparl_id": "1-3422",
    "filename": "2008/2008-11-27_Bekanntmachung_(Fachausschuss_Finanzen,_Wirtschaftsförderung_und_Marketing)_1-3422.pdf",
    "access_url": "https://nordstemmen.ratsinfomanagement.net/webservice/oparl/v1.1/body/1/files/UGhVM0hpd2NXNFdFcExjZWtBR0dzdsflDACoeztcTrx-Vcg9lRy46h0hVC4uHFnz/Bekanntmachung_Fachausschuss_Finanzen-_Wirtschaftsfoerderung_und_Marketing_27.11.2008.pdf",
    "mime_type": "application/pdf",
    "name": "Bekanntmachung (Fachausschuss Finanzen, Wirtschaftsförderung und Marketing)",
    "date": "2008-11-27",
    "downloaded_at": "2025-11-12T10:30:41.608Z"
  },
  "1-3248": {
    "oparl_id": "1-3248",
    "filename": "2008/2008-11-06_Bekanntmachung_(Ortsrat_Heyersum)_1-3248.pdf",
    "access_url": "https://nordstemmen.ratsinfomanagement.net/webservice/oparl/v1.1/body/1/files/UGhVM0hpd2NXNFdFcExjZeikiaG2bKnkU_ZDiuc_IaukLjAWupLb2sZ2rVPFPqXS/Bekanntmachung_Ortsrat_Heyersum_06.11.2008.pdf",
    "mime_type": "application/pdf",
    "name": "Bekanntmachung (Ortsrat Heyersum)",
    "date": "2008-11-06",
    "downloaded_at": "2025-11-12T10:30:41.620Z"
  },
  "1-3331": {
    "oparl_id": "1-3331",
    "filename": "2008/2008-11-19_Bekanntmachung_(Fachausschuss_Schulen)_1-3331.pdf",
    "access_url": "https://nordstemmen.ratsinfomanagement.net/webservice/oparl/v1.1/body/1/files/UGhVM0hpd2NXNFdFcExjZQFiQ-zG2AFdDOwjfQNhfFtIPbSJ0gmrgTZyWNM4AK7f/Bekanntmachung_Fachausschuss_Schulen_19.11.2008.pdf",
    "mime_type": "application/pdf",
    "name": "Bekanntmachung (Fachausschuss Schulen)",
    "date": "2008-11-19",
    "downloaded_at": "2025-11-12T10:30:41.718Z"
  },
  "1-3427": {
    "oparl_id": "1-3427",
    "filename": "2008/2008-12-04_Bekanntmachung_(Rat)_1-3427.pdf",
    "access_url": "https://nordstemmen.ratsinfomanagement.net/webservice/oparl/v1.1/body/1/files/UGhVM0hpd2NXNFdFcExjZTAItlzNev0fWtWR0RlhlWtsvMlWRl-7sayXzdBCJ5pu/Bekanntmachung_Rat_04.12.2008.pdf",
    "mime_type": "application/pdf",
    "name": "Bekanntmachung (Rat)",
    "date": "2008-12-04",
    "downloaded_at": "2025-11-12T10:30:41.864Z"
  },
  "1-3115": {
    "oparl_id": "1-3115",
    "filename": "2008/2008-11-13_Beschlussvorlage_(Bebauungsplan_Nr._0129_A__ÖPNV-Haltepunkt_Bahnhof_Nordstemmen_II__Ortschaft_Nordstemmen;_Satzungsbeschluss_gem._§_10_Abs._1_BauGB)_1-3115.pdf",
    "access_url": "https://nordstemmen.ratsinfomanagement.net/webservice/oparl/v1.1/body/1/files/UGhVM0hpd2NXNFdFcExjZZiqtwwcscTRIKKp-4HEgdA4nb9XLmEEPsANevWsl4VZ/Beschlussvorlage_DS_58-2008.pdf",
    "mime_type": "application/pdf",
    "name": "Beschlussvorlage (Bebauungsplan Nr. 0129 A \"ÖPNV-Haltepunkt Bahnhof Nordstemmen II\" Ortschaft Nordstemmen;\n\nSatzungsbeschluss gem. § 10 Abs. 1 BauGB)",
    "date": "2008-11-13",
    "downloaded_at": "2025-11-12T10:30:41.948Z"
  },
  "1-3162": {
    "oparl_id": "1-3162",
    "filename": "2008/2008-10-30_Beschlussvorlage_(Abschluss_einer_Vereinbarung_bezüglich_der_Nutzungsüberlassung_des_Sammlungsraumes_in_der__Rolf-Gehrke-Halle__in_der_Ortschaft_Adensen)_1-3162.pdf",
    "access_url": "https://nordstemmen.ratsinfomanagement.net/webservice/oparl/v1.1/body/1/files/UGhVM0hpd2NXNFdFcExjZRNVCCDWdtZM7yXZgUXfsiGHd3o8nw8ympsh5dB6q-Sc/Beschlussvorlage_DS_65-2008.pdf",
    "mime_type": "application/pdf",
    "name": "Beschlussvorlage (Abschluss einer Vereinbarung bezüglich der Nutzungsüberlassung des Sammlungsraumes in der \"Rolf-Gehrke-Halle\" in der Ortschaft Adensen)",
    "date": "2008-10-30",
    "downloaded_at": "2025-11-12T10:30:42.025Z"
  },
  "1-3185": {
    "oparl_id": "1-3185",
    "filename": "2008/2008-11-13_Beschlussvorlage_(Bebauungsplan_Nr._0103_A__Schratfeld_,_6._Änderung,_Ortschaft_Nordstemmen;_Satzungsbeschluss_gem._§_10_Abs._1_BauGB)_1-3185.pdf",
    "access_url": "https://nordstemmen.ratsinfomanagement.net/webservice/oparl/v1.1/body/1/files/UGhVM0hpd2NXNFdFcExjZdrvO-Ff2a4IKUjWneOV2Va9DocdEIxBMvaPwDw7o72u/Beschlussvorlage_DS_56-2008.pdf",
    "mime_type": "application/pdf",
    "name": "Beschlussvorlage (Bebauungsplan Nr. 0103 A \"Schratfeld\", 6. Änderung, Ortschaft Nordstemmen;\n\nSatzungsbeschluss gem. § 10 Abs. 1 BauGB)",
    "date": "2008-11-13",
    "downloaded_at": "2025-11-12T10:30:42.040Z"
  },
  "1-3261": {
    "oparl_id": "1-3261",
    "filename": "2008/2008-11-10_Beschlussvorlage_(Anhörung_des_Ortsrates_zum_Haushaltsplan_2009_und_zum_Investitionsprogramm_für_den_Investitionszeitraum_bis_zum_Haushaltsjahr_2012_unter_Fortschreibung_des_Haushaltssi.pdf",
    "access_url": "https://nordstemmen.ratsinfomanagement.net/webservice/oparl/v1.1/body/1/files/UGhVM0hpd2NXNFdFcExjZf1ak12lOmxCRSx3QWncqMBBQDkT29VLNMemPzK_g2yA/Beschlussvorlage_DS_74-2008.pdf",
    "mime_type": "application/pdf",
    "name": "Beschlussvorlage (Anhörung des Ortsrates zum Haushaltsplan 2009 und zum Investitionsprogramm für den Investitionszeitraum bis zum Haushaltsjahr 2012 unter Fortschreibung des Haushaltssicherungskonzeptes)",
    "date": "2008-11-10",
    "downloaded_at": "2025-11-12T10:30:42.102Z"
  },
  "1-3264": {
    "oparl_id": "1-3264",
    "filename": "2008/2008-11-12_Beschlussvorlage_(Anhörung_des_Ortsrates_zum_Haushaltsplan_2009_und_zum_Investitionsprogramm_für_den_Investitionszeitraum_bis_zum_Haushaltsjahr_2012_)_1-3264.pdf",
    "access_url": "https://nordstemmen.ratsinfomanagement.net/webservice/oparl/v1.1/body/1/files/UGhVM0hpd2NXNFdFcExjZfBb2BvuXggJNxy63VAvcToOYEFcTeNtE5du327pQFpl/Beschlussvorlage_DS_75-2008.pdf",
    "mime_type": "application/pdf",
    "name": "Beschlussvorlage (Anhörung des Ortsrates zum Haushaltsplan 2009 und zum Investitionsprogramm für den Investitionszeitraum bis zum Haushaltsjahr 2012 )",
    "date": "2008-11-12",
    "downloaded_at": "2025-11-12T10:30:42.128Z"
  },
  "1-3267": {
    "oparl_id": "1-3267",
    "filename": "2008/2008-11-17_Beschlussvorlage_(Anhörung_des_Ortsrates_zum_Haushaltsplan_2009_und_zum_Investitionsprogramm_für_den_Investitionszeitraum_bis_zum_Haushaltsjahr_2012)_1-3267.pdf",
    "access_url": "https://nordstemmen.ratsinfomanagement.net/webservice/oparl/v1.1/body/1/files/UGhVM0hpd2NXNFdFcExjZbCtX-ZwNXzIG_YyKZmmHgmtbjAiayEmdNDKg6ATg51r/Beschlussvorlage_DS_76-2008.pdf",
    "mime_type": "application/pdf",
    "name": "Beschlussvorlage (Anhörung des Ortsrates zum Haushaltsplan 2009 und zum Investitionsprogramm für den Investitionszeitraum bis zum Haushaltsjahr 2012)",
    "date": "2008-11-17",
    "downloaded_at": "2025-11-12T10:30:42.135Z"
  },
  "1-3100": {
    "oparl_id": "1-3100",
    "filename": "2008/2008-11-13_Beschlussvorlage_(1._Änderung_der_Satzung_für_die_Frauenbeauftragte_der_Gemeinde_Nordstemmen;_Erhöhung_der_Aufwandsentschädigung)_1-3100.pdf",
    "access_url": "https://nordstemmen.ratsinfomanagement.net/webservice/oparl/v1.1/body/1/files/UGhVM0hpd2NXNFdFcExjZbLdlBU_WQbtrgR6e6IhdNA6_lXynjvG2nct37JQ71ro/Beschlussvorlage_DS_62-2008.pdf",
    "mime_type": "application/pdf",
    "name": "Beschlussvorlage (1. Änderung der Satzung für die Frauenbeauftragte der Gemeinde Nordstemmen;\nErhöhung der Aufwandsentschädigung)",
    "date": "2008-11-13",
    "downloaded_at": "2025-11-12T10:30:42.145Z"
  },
  "1-3318": {
    "oparl_id": "1-3318",
    "filename": "2008/2008-12-04_Beschlussvorlage_(Gewährung_eines_Zuschusses_an_den_Verein_„KOMM_e._V.“_im_Rahmen_des_Förderprogramms_„Familie_und_Zukunft_-_Kinder_bilden_und_betreuen“)_1-3318.pdf",
    "access_url": "https://nordstemmen.ratsinfomanagement.net/webservice/oparl/v1.1/body/1/files/UGhVM0hpd2NXNFdFcExjZaChaaBd70vUz7Lbed9gMryubolDgnOjhFqpcP9L3Gqo/Beschlussvorlage_DS_79-2008.pdf",
    "mime_type": "application/pdf",
    "name": "Beschlussvorlage (Gewährung eines Zuschusses an den Verein „KOMM e. V.“ im Rahmen des Förderprogramms „Familie und Zukunft - Kinder bilden und betreuen“)",
    "date": "2008-12-04",
    "downloaded_at": "2025-11-12T10:30:42.190Z"
  },
  "1-3312": {
    "oparl_id": "1-3312",
    "filename": "2008/2008-12-04_Beschlussvorlage_(I._Nachtragshaushaltssatzung_mit_I._Nachtragshaushaltsplan_für_das_Haushaltsjahr_2008)_1-3312.pdf",
    "access_url": "https://nordstemmen.ratsinfomanagement.net/webservice/oparl/v1.1/body/1/files/UGhVM0hpd2NXNFdFcExjZRNUcFqU4GIypAa75m9HnyfoyivPwk5uy6CQb2-IH5Tf/Beschlussvorlage_DS_78-2008.pdf",
    "mime_type": "application/pdf",
    "name": "Beschlussvorlage (I. Nachtragshaushaltssatzung mit I. Nachtragshaushaltsplan für das Haushaltsjahr 2008)",
    "date": "2008-12-04",
    "downloaded_at": "2025-11-12T10:30:42.190Z"
  },
  "1-3416": {
    "oparl_id": "1-3416",
    "filename": "2008/2008-11-20_Beschlussvorlage_(Vergabe_eines_Planungsauftrages_für_die_Dorferneuerungsmaßnahme_Düsterer_Pump,_Ortschaft_Adensen)_1-3416.pdf",
    "access_url": "https://nordstemmen.ratsinfomanagement.net/webservice/oparl/v1.1/body/1/files/UGhVM0hpd2NXNFdFcExjZeSZ3FS-9ARfD0v69t4DBpb5EMuEv7ODqctr426opaiH/Beschlussvorlage_DS_85-2008.pdf",
    "mime_type": "application/pdf",
    "name": "Beschlussvorlage (Vergabe eines Planungsauftrages für die Dorferneuerungsmaßnahme Düsterer Pump, Ortschaft Adensen)",
    "date": "2008-11-20",
    "downloaded_at": "2025-11-12T10:30:42.225Z"
  },
  "1-3661": {
    "oparl_id": "1-3661",
    "filename": "2009/2009-02-26_Bekanntmachung_(Fachausschuss_Finanzen,_Wirtschaftsförderung_und_Marketing)_1-3661.pdf",
    "access_url": "https://nordstemmen.ratsinfomanagement.net/webservice/oparl/v1.1/body/1/files/UGhVM0hpd2NXNFdFcExjZTvbIr9XKA5dNi-TbIyGCdF77KGB-aQxGFDpyHuGv1Ju/Bekanntmachung_Fachausschuss_Finanzen-_Wirtschaftsfoerderung_und_Marketing_26.02.2009.pdf",
    "mime_type": "application/pdf",
    "name": "Bekanntmachung (Fachausschuss Finanzen, Wirtschaftsförderung und Marketing)",
    "date": "2009-02-26",
    "downloaded_at": "2025-11-12T10:30:42.226Z"
  },
  "1-3355": {
    "oparl_id": "1-3355",
    "filename": "2008/2008-11-20_Bekanntmachung_(Fachausschuss_Planung,_Bau,_Umwelt,_Feuerschutz)_1-3355.pdf",
    "access_url": "https://nordstemmen.ratsinfomanagement.net/webservice/oparl/v1.1/body/1/files/UGhVM0hpd2NXNFdFcExjZafoVNxsSJ_ZdFq2Y62I2DAiUXl84MpxW9kZnV1K2jP_/Bekanntmachung_Fachausschuss_Planung-_Bau-_Umwelt-_Feuerschutz_20.11.2008.pdf",
    "mime_type": "application/pdf",
    "name": "Bekanntmachung (Fachausschuss Planung, Bau, Umwelt, Feuerschutz)",
    "date": "2008-11-20",
    "downloaded_at": "2025-11-12T10:30:42.226Z"
  },
  "1-3672": {
    "oparl_id": "1-3672",
    "filename": "2009/2009-03-09_Bekanntmachung_(Fachausschuss_Freizeit,_Kultur,_Jugend,_Soziales,_Demographie)_1-3672.pdf",
    "access_url": "https://nordstemmen.ratsinfomanagement.net/webservice/oparl/v1.1/body/1/files/UGhVM0hpd2NXNFdFcExjZVAbEbrZo_zOrOYnwZ3UD88dduQM6kOoIfMKlClIj0lq/Bekanntmachung_Fachausschuss_Freizeit-_Kultur-_Jugend-_Soziales-_Demographie_09.03.2009.pdf",
    "mime_type": "application/pdf",
    "name": "Bekanntmachung (Fachausschuss Freizeit, Kultur, Jugend, Soziales, Demographie)",
    "date": "2009-03-09",
    "downloaded_at": "2025-11-12T10:30:42.227Z"
  },
  "1-3255": {
    "oparl_id": "1-3255",
    "filename": "2008/2008-11-10_Beschlussvorlage_(Anhörung_des_Ortsrates_zum_Haushaltsplan_2009_und_zum_Investitionsprogramm_für_den_Investitionszeitraum_bis_zum_Haushaltsjahr_2012_unter_Fortschreibung_des_Haushaltssi.pdf",
    "access_url": "https://nordstemmen.ratsinfomanagement.net/webservice/oparl/v1.1/body/1/files/UGhVM0hpd2NXNFdFcExjZRgvCm30mn6RZW61Q0dy7-mkH9eNU0tTOU0wC0JMarPq/Beschlussvorlage_DS_73-2008.pdf",
    "mime_type": "application/pdf",
    "name": "Beschlussvorlage (Anhörung des Ortsrates zum Haushaltsplan 2009 und zum Investitionsprogramm für den Investitionszeitraum bis zum Haushaltsjahr 2012 unter Fortschreibung des Haushaltssicherungskonzeptes)",
    "date": "2008-11-10",
    "downloaded_at": "2025-11-12T10:30:42.246Z"
  },
  "1-3309": {
    "oparl_id": "1-3309",
    "filename": "2008/2008-12-04_Mitteilungsvorlage_(Unterrichtung_über_die_Aufnahme_eines_Kommunaldarlehens_gemäß_§_7_der_Richtlinie_der_Gemeinde_Nordstemmen_für_die_Aufnahme_von_Krediten_und_zur_Umschuldung_von_Kredi.pdf",
    "access_url": "https://nordstemmen.ratsinfomanagement.net/webservice/oparl/v1.1/body/1/files/UGhVM0hpd2NXNFdFcExjZSniraW_lUTajWGHxcE1DdeFedoC0OauZiJTAGMp9UDD/Mitteilungsvorlage_DS_77-2008.pdf",
    "mime_type": "application/pdf",
    "name": "Mitteilungsvorlage (Unterrichtung über die Aufnahme eines Kommunaldarlehens gemäß § 7 der Richtlinie der Gemeinde Nordstemmen für die Aufnahme von Krediten und zur Umschuldung von Krediten vom 14. Juni 2007)",
    "date": "2008-12-04",
    "downloaded_at": "2025-11-12T10:30:42.258Z"
  },
  "1-3670": {
    "oparl_id": "1-3670",
    "filename": "2009/2009-03-09_Bekanntmachung_(Ortsrat_Nordstemmen)_1-3670.pdf",
    "access_url": "https://nordstemmen.ratsinfomanagement.net/webservice/oparl/v1.1/body/1/files/UGhVM0hpd2NXNFdFcExjZTgwSg1goGHqa4OIf5tUtrbzIuKCw-_haZuCd4Q0mXmW/Bekanntmachung_Ortsrat_Nordstemmen_09.03.2009.pdf",
    "mime_type": "application/pdf",
    "name": "Bekanntmachung (Ortsrat Nordstemmen)",
    "date": "2009-03-09",
    "downloaded_at": "2025-11-12T10:30:42.259Z"
  },
  "1-3339": {
    "oparl_id": "1-3339",
    "filename": "2008/2008-12-04_Beschlussvorlage_(Vereinbarung_zur_Wahrnehmung_der_Aufgaben_der_Kindertagesbetreuung_und_der_Kindertagespflege)_1-3339.pdf",
    "access_url": "https://nordstemmen.ratsinfomanagement.net/webservice/oparl/v1.1/body/1/files/UGhVM0hpd2NXNFdFcExjZSX4OGnrcRPmFt6kKqiPy84InaGAA8amNEyrw-LZvxrO/Beschlussvorlage_DS_82-2008.pdf",
    "mime_type": "application/pdf",
    "name": "Beschlussvorlage (Vereinbarung zur Wahrnehmung der Aufgaben der Kindertagesbetreuung und der Kindertagespflege)",
    "date": "2008-12-04",
    "downloaded_at": "2025-11-12T10:30:42.260Z"
  },
  "1-3748": {
    "oparl_id": "1-3748",
    "filename": "2009/2009-03-26_Bekanntmachung_(Ortsrat_Nordstemmen)_1-3748.pdf",
    "access_url": "https://nordstemmen.ratsinfomanagement.net/webservice/oparl/v1.1/body/1/files/UGhVM0hpd2NXNFdFcExjZQqWN44rxcvF1pjggmrDaeLWBn-LBnbLHS7CuXtY2yLf/Bekanntmachung_Ortsrat_Nordstemmen_26.03.2009.pdf",
    "mime_type": "application/pdf",
    "name": "Bekanntmachung (Ortsrat Nordstemmen)",
    "date": "2009-03-26",
    "downloaded_at": "2025-11-12T10:30:42.268Z"
  },
  "1-3323": {
    "oparl_id": "1-3323",
    "filename": "2008/2008-12-04_Beschlussvorlage_(Gewährung_eines_Zuschusses_an_den_Verein_„KOMM_e._V.“_für_die_Betreuungsangebote_„Krippe“_und_„Hort“)_1-3323.pdf",
    "access_url": "https://nordstemmen.ratsinfomanagement.net/webservice/oparl/v1.1/body/1/files/UGhVM0hpd2NXNFdFcExjZT3YMfD7mdde25XqXLcmDxMyB2_g4yP-n3G-ecGSNtKH/Beschlussvorlage_DS_80-2008.pdf",
    "mime_type": "application/pdf",
    "name": "Beschlussvorlage (Gewährung eines Zuschusses an den Verein „KOMM e. V.“ für die Betreuungsangebote „Krippe“ und „Hort“)",
    "date": "2008-12-04",
    "downloaded_at": "2025-11-12T10:30:42.279Z"
  },
  "1-3119": {
    "oparl_id": "1-3119",
    "filename": "2008/2008-11-13_Beschlussvorlage_(Bebauungsplan_Nr._0120__Hauptstraße_-_Mitte_III_,_1._Änderung,_Ortschaft_Nordstemmen;_Satzungsbeschluss_gem._§_10_Abs._1_BauGB)_1-3119.pdf",
    "access_url": "https://nordstemmen.ratsinfomanagement.net/webservice/oparl/v1.1/body/1/files/UGhVM0hpd2NXNFdFcExjZarmTeEiBXmX5dg6K_TC3qFYTlyJyPlNFR12MHcalneY/Beschlussvorlage_DS_57-2008.pdf",
    "mime_type": "application/pdf",
    "name": "Beschlussvorlage (Bebauungsplan Nr. 0120 \"Hauptstraße - Mitte III\", 1. Änderung, Ortschaft Nordstemmen;\n\nSatzungsbeschluss gem. § 10 Abs. 1 BauGB)",
    "date": "2008-11-13",
    "downloaded_at": "2025-11-12T10:30:42.279Z"
  },
  "1-3346": {
    "oparl_id": "1-3346",
    "filename": "2008/2008-12-04_Beschlussvorlage_(Erhöhung_der_Zuschüsse_an_die_Vereine_für_die_Bewirtschaftung_der_übertragenen_kulturellen_und_sportlichen_Einrichtungen)_1-3346.pdf",
    "access_url": "https://nordstemmen.ratsinfomanagement.net/webservice/oparl/v1.1/body/1/files/UGhVM0hpd2NXNFdFcExjZXIUuOJGSg6z67uTpKipp0_6mZ0pldQLoxp-B5YGbYtv/Beschlussvorlage_DS_81-2008.pdf",
    "mime_type": "application/pdf",
    "name": "Beschlussvorlage (Erhöhung der Zuschüsse an die Vereine für die Bewirtschaftung der übertragenen kulturellen und sportlichen Einrichtungen)",
    "date": "2008-12-04",
    "downloaded_at": "2025-11-12T10:30:42.295Z"
  },
  "1-3675": {
    "oparl_id": "1-3675",
    "filename": "2009/2009-03-19_Bekanntmachung_(Rat)_1-3675.pdf",
    "access_url": "https://nordstemmen.ratsinfomanagement.net/webservice/oparl/v1.1/body/1/files/UGhVM0hpd2NXNFdFcExjZdy_6j3mf6SZKtc4hZjVZMn8gtcTr4lN2DUJg3b69ULD/Bekanntmachung_Rat_19.03.2009.pdf",
    "mime_type": "application/pdf",
    "name": "Bekanntmachung (Rat)",
    "date": "2009-03-19",
    "downloaded_at": "2025-11-12T10:30:42.312Z"
  },
  "1-3664": {
    "oparl_id": "1-3664",
    "filename": "2009/2009-03-19_Beschlussvorlage_(Freizeitbad_Nordstemmen__Verlauf_Badesaison_2008_Konzept_für_die_Badesaison_2009_Investitionen)_1-3664.pdf",
    "access_url": "https://nordstemmen.ratsinfomanagement.net/webservice/oparl/v1.1/body/1/files/UGhVM0hpd2NXNFdFcExjZd9h07BA4kB5ppCVP6Vf_c6W2tWt6JW6FkTDB3r1bXj7/Beschlussvorlage_DS_6-2009.pdf",
    "mime_type": "application/pdf",
    "name": "Beschlussvorlage (Freizeitbad Nordstemmen:\nVerlauf Badesaison 2008\nKonzept für die Badesaison 2009\nInvestitionen)",
    "date": "2009-03-19",
    "downloaded_at": "2025-11-12T10:30:42.403Z"
  },
  "1-650": {
    "oparl_id": "1-650",
    "filename": "2006/2006-12-13_Beschlussvorlage_(Bebauungsplan_Nr._0125__Mahlerter_Straße-Nord_,_2._Änderung,_Ortschaft_Nordstemmen;_Aufstellungsbeschluss)_1-650.pdf",
    "access_url": "https://nordstemmen.ratsinfomanagement.net/webservice/oparl/v1.1/body/1/files/UGhVM0hpd2NXNFdFcExjZdaIGKykw1hiW4ieW_KzFUMUxFkQnez-JgbQDjAbPwFX/Beschlussvorlage_DS_57-2006.pdf",
    "mime_type": "application/pdf",
    "name": "Beschlussvorlage (Bebauungsplan Nr. 0125 \"Mahlerter Straße-Nord\", 2. Änderung, Ortschaft Nordstemmen;\nAufstellungsbeschluss)",
    "date": "2006-12-13",
    "downloaded_at": "2025-11-12T10:30:42.411Z"
  },
  "1-3767": {
    "oparl_id": "1-3767",
    "filename": "2009/2009-04-22_Bekanntmachung_(Ortsrat_Mahlerten)_1-3767.pdf",
    "access_url": "https://nordstemmen.ratsinfomanagement.net/webservice/oparl/v1.1/body/1/files/UGhVM0hpd2NXNFdFcExjZU-f6bRmu7WQf5Aato9VDq9k4scNzVdd-LMeXWuZvi9T/Bekanntmachung_Ortsrat_Mahlerten_22.04.2009.pdf",
    "mime_type": "application/pdf",
    "name": "Bekanntmachung (Ortsrat Mahlerten)",
    "date": "2009-04-22",
    "downloaded_at": "2025-11-12T10:30:42.435Z"
  },
  "1-647": {
    "oparl_id": "1-647",
    "filename": "2006/2006-12-13_Beschlussvorlage_(Bebauungsplan_Nr._0122__Innerörtliche_Verbindungsstraße___Zuckerfabrik_,_5._Änderung,_Ortschaft_Nordstemmen;_öffentliche_Auslegung)_1-647.pdf",
    "access_url": "https://nordstemmen.ratsinfomanagement.net/webservice/oparl/v1.1/body/1/files/UGhVM0hpd2NXNFdFcExjZatHLmj43a4X60P65q8MnyFM95ifWAtnKMMFEEMQt6qz/Beschlussvorlage_DS_56-2006.pdf",
    "mime_type": "application/pdf",
    "name": "Beschlussvorlage (Bebauungsplan Nr. 0122 \"Innerörtliche Verbindungsstraße / Zuckerfabrik\", 5. Änderung, Ortschaft Nordstemmen;\nöffentliche Auslegung)",
    "date": "2006-12-13",
    "downloaded_at": "2025-11-12T10:30:42.435Z"
  },
  "1-3769": {
    "oparl_id": "1-3769",
    "filename": "2009/2009-04-23_Bekanntmachung_(Ortsrat_Barnten)_1-3769.pdf",
    "access_url": "https://nordstemmen.ratsinfomanagement.net/webservice/oparl/v1.1/body/1/files/UGhVM0hpd2NXNFdFcExjZVkmPzcHSlCGFHbm8C6-a3s3of_tY6D1bhLwzx9bULRN/Bekanntmachung_Ortsrat_Barnten_23.04.2009.pdf",
    "mime_type": "application/pdf",
    "name": "Bekanntmachung (Ortsrat Barnten)",
    "date": "2009-04-23",
    "downloaded_at": "2025-11-12T10:30:42.476Z"
  },
  "1-3773": {
    "oparl_id": "1-3773",
    "filename": "2009/2009-04-20_Bekanntmachung_(Ortsrat_Adensen)_1-3773.pdf",
    "access_url": "https://nordstemmen.ratsinfomanagement.net/webservice/oparl/v1.1/body/1/files/UGhVM0hpd2NXNFdFcExjZTbA12GNO-fK_EXVQErUwpvZahVpRCMdh9piLjfcZ7g_/Bekanntmachung_Ortsrat_Adensen_20.04.2009.pdf",
    "mime_type": "application/pdf",
    "name": "Bekanntmachung (Ortsrat Adensen)",
    "date": "2009-04-20",
    "downloaded_at": "2025-11-12T10:30:42.492Z"
  },
  "1-3244": {
    "oparl_id": "1-3244",
    "filename": "2008/2008-11-05_Bekanntmachung_(Ortsrat_Rössing)_1-3244.pdf",
    "access_url": "https://nordstemmen.ratsinfomanagement.net/webservice/oparl/v1.1/body/1/files/UGhVM0hpd2NXNFdFcExjZSInXeeQf2VIYYDfH4U5n9UazBbBmJRLgRFfIzAWO9fm/Bekanntmachung_Ortsrat_Roessing_05.11.2008.pdf",
    "mime_type": "application/pdf",
    "name": "Bekanntmachung (Ortsrat Rössing)",
    "date": "2008-11-05",
    "downloaded_at": "2025-11-12T10:30:42.521Z"
  },
  "1-3775": {
    "oparl_id": "1-3775",
    "filename": "2009/2009-04-21_Bekanntmachung_(Ortsrat_Groß_Escherde)_1-3775.pdf",
    "access_url": "https://nordstemmen.ratsinfomanagement.net/webservice/oparl/v1.1/body/1/files/UGhVM0hpd2NXNFdFcExjZc4hkIlf37mXmieaxCOT17wRHu6Ag6uWe17Q_Hk40Vsl/Bekanntmachung_Ortsrat_Gross_Escherde_21.04.2009.pdf",
    "mime_type": "application/pdf",
    "name": "Bekanntmachung (Ortsrat Groß Escherde)",
    "date": "2009-04-21",
    "downloaded_at": "2025-11-12T10:30:42.534Z"
  },
  "1-3771": {
    "oparl_id": "1-3771",
    "filename": "2009/2009-04-22_Bekanntmachung_(Ortsrat_Burgstemmen)_1-3771.pdf",
    "access_url": "https://nordstemmen.ratsinfomanagement.net/webservice/oparl/v1.1/body/1/files/UGhVM0hpd2NXNFdFcExjZb6dpt8mnYr9o77ZWbNR-4URO4V8o3W4giBRWYKG60xV/Bekanntmachung_Ortsrat_Burgstemmen_22.04.2009.pdf",
    "mime_type": "application/pdf",
    "name": "Bekanntmachung (Ortsrat Burgstemmen)",
    "date": "2009-04-22",
    "downloaded_at": "2025-11-12T10:30:42.534Z"
  },
  "1-3654": {
    "oparl_id": "1-3654",
    "filename": "2009/2009-02-19_Bekanntmachung_(Fachausschuss_Schulen)_1-3654.pdf",
    "access_url": "https://nordstemmen.ratsinfomanagement.net/webservice/oparl/v1.1/body/1/files/UGhVM0hpd2NXNFdFcExjZdaeBDvLtcXWta0y7ivInSBtkNBAwLrXMH-y88a_3n1p/Bekanntmachung_Fachausschuss_Schulen_19.02.2009.pdf",
    "mime_type": "application/pdf",
    "name": "Bekanntmachung (Fachausschuss Schulen)",
    "date": "2009-02-19",
    "downloaded_at": "2025-11-12T10:30:42.546Z"
  },
  "1-3625": {
    "oparl_id": "1-3625",
    "filename": "2009/2009-02-12_Bekanntmachung_(Fachausschuss_Planung,_Bau,_Umwelt,_Feuerschutz)_1-3625.pdf",
    "access_url": "https://nordstemmen.ratsinfomanagement.net/webservice/oparl/v1.1/body/1/files/UGhVM0hpd2NXNFdFcExjZcUjtJiPuwY7Pk3FXRIeRLGSVRybwKJdQ8fEpqqJ8tyZ/Bekanntmachung_Fachausschuss_Planung-_Bau-_Umwelt-_Feuerschutz_12.02.2009.pdf",
    "mime_type": "application/pdf",
    "name": "Bekanntmachung (Fachausschuss Planung, Bau, Umwelt, Feuerschutz)",
    "date": "2009-02-12",
    "downloaded_at": "2025-11-12T10:30:42.558Z"
  },
  "1-3777": {
    "oparl_id": "1-3777",
    "filename": "2009/2009-04-20_Bekanntmachung_(Ortsrat_Heyersum)_1-3777.pdf",
    "access_url": "https://nordstemmen.ratsinfomanagement.net/webservice/oparl/v1.1/body/1/files/UGhVM0hpd2NXNFdFcExjZXETMrjkrMYMd0N5xtXV6xgbyu6Cft04i_yoBhFP7mE-/Bekanntmachung_Ortsrat_Heyersum_20.04.2009.pdf",
    "mime_type": "application/pdf",
    "name": "Bekanntmachung (Ortsrat Heyersum)",
    "date": "2009-04-20",
    "downloaded_at": "2025-11-12T10:30:42.560Z"
  },
  "1-3779": {
    "oparl_id": "1-3779",
    "filename": "2009/2009-04-23_Bekanntmachung_(Ortsrat_Rössing)_1-3779.pdf",
    "access_url": "https://nordstemmen.ratsinfomanagement.net/webservice/oparl/v1.1/body/1/files/UGhVM0hpd2NXNFdFcExjZWOQGNBVIj2RcIaO38t937Sen4b52BnP-ntRy5nnec3p/Bekanntmachung_Ortsrat_Roessing_23.04.2009.pdf",
    "mime_type": "application/pdf",
    "name": "Bekanntmachung (Ortsrat Rössing)",
    "date": "2009-04-23",
    "downloaded_at": "2025-11-12T10:30:42.562Z"
  },
  "1-598": {
    "oparl_id": "1-598",
    "filename": "2006/2006-11-23_Beschlussvorlage_(Nachtabschaltung_der_Straßenbeleuchtung_im_Gebiet_der_Gemeinde_Nordstemmen;_Änderung_der_Schaltzeiten)_1-598.pdf",
    "access_url": "https://nordstemmen.ratsinfomanagement.net/webservice/oparl/v1.1/body/1/files/UGhVM0hpd2NXNFdFcExjZdnoNqFFVnzEEIsC2II4UocnOqAPDgdPPiHuJK81stGi/Beschlussvorlage_DS_45-2006.pdf",
    "mime_type": "application/pdf",
    "name": "Beschlussvorlage (Nachtabschaltung der Straßenbeleuchtung im Gebiet der Gemeinde Nordstemmen;\nÄnderung der Schaltzeiten)",
    "date": "2006-11-23",
    "downloaded_at": "2025-11-12T10:30:42.607Z"
  },
  "1-3866": {
    "oparl_id": "1-3866",
    "filename": "2009/2009-05-14_Bekanntmachung_(Fachausschuss_Planung,_Bau,_Umwelt,_Feuerschutz)_1-3866.pdf",
    "access_url": "https://nordstemmen.ratsinfomanagement.net/webservice/oparl/v1.1/body/1/files/UGhVM0hpd2NXNFdFcExjZW4z6L6gSbhFHg_a1SGpj3jYbGzSe-fCiYnivYYh5j_E/Bekanntmachung_Fachausschuss_Planung-_Bau-_Umwelt-_Feuerschutz_14.05.2009.pdf",
    "mime_type": "application/pdf",
    "name": "Bekanntmachung (Fachausschuss Planung, Bau, Umwelt, Feuerschutz)",
    "date": "2009-05-14",
    "downloaded_at": "2025-11-12T10:30:42.624Z"
  },
  "1-3854": {
    "oparl_id": "1-3854",
    "filename": "2009/2009-05-14_Mitteilungsvorlage_(Tätigkeitsbericht_der_Umweltschutzbeauftragten)_1-3854.pdf",
    "access_url": "https://nordstemmen.ratsinfomanagement.net/webservice/oparl/v1.1/body/1/files/UGhVM0hpd2NXNFdFcExjZWU2NtNxChhpWtcqOLZ46mNOYrltxUx1_ltyIgWpK-pH/Mitteilungsvorlage_DS_21-2009.pdf",
    "mime_type": "application/pdf",
    "name": "Mitteilungsvorlage (Tätigkeitsbericht der Umweltschutzbeauftragten)",
    "date": "2009-05-14",
    "downloaded_at": "2025-11-12T10:30:42.625Z"
  },
  "1-594": {
    "oparl_id": "1-594",
